"tool_mage_url","tool","tool_description","category","upvotes","tags"
"https://global-uploads.webflow.com/63994dae1033718bee6949ce/645bd29bcb682dfdb9c2d3b9_Screen%20Shot%202023-05-10%20at%2010.49.01%20PM.png","Inbox Narrator","An app for email summaries delivered by a voice assistant.","Productivity","1",""
"https://global-uploads.webflow.com/63994dae1033718bee6949ce/645bcc3d89673d8485cf5c9a_chattube-io-logo.webp","ChatTube","A Google Chrome Extension to chat with any youtube video.","Chat","5",""
"https://global-uploads.webflow.com/63994dae1033718bee6949ce/645b3f36639d02730fb1e8c5_smaller_for_website_transparent%2520logo.png","Bito","A tool to generate custom designs for any project, including NFTs.","Generative Art","3",""
"https://global-uploads.webflow.com/63994dae1033718bee6949ce/645bcb535cb989259c72991e_bugasura-io-logo.svg","Bagasura","A platform for bug tracking, streamlining workflows and collaboration.","Productivity","2",""
"https://global-uploads.webflow.com/63994dae1033718bee6949ce/6459d01255b7ff41691d6752_meta.jpeg","CometCore AI","A chat platform for automating tasks and creating multimedia content.","Chat","10",""
"https://global-uploads.webflow.com/63994dae1033718bee6949ce/6459d01155b7ff505b1d6748_shap-e.png","Shap-e","A GitHub repository to generate 3D objects from text or images.","Generative Art","9",""
"https://global-uploads.webflow.com/63994dae1033718bee6949ce/6459d00e824508eb09673511_wpgpt-1.png","WPGPT","A WordPress plugin to monetize chatbots.","Chat","36",""
"https://global-uploads.webflow.com/63994dae1033718bee6949ce/6459d00e42367820843024a7_a62a86_e3802d6500ac4abe9f5c5738e97781bc%257Emv2.png","Breeze","A tool to create professional product photos","Image Improvement","11",""
"https://global-uploads.webflow.com/63994dae1033718bee6949ce/645a0b16ec3d2ab8da7113b5_pagegpt-pro-logo.png","PageGPT","A tool to generate landing pages.","Marketing","19",""
"https://global-uploads.webflow.com/63994dae1033718bee6949ce/645a0a96d6748ac4c74f84be_dreamlook-ai-logo.png","Dreamlook.ai","A platform to train models and fine tuning for image generation.","Generative Art","28",""
"https://global-uploads.webflow.com/63994dae1033718bee6949ce/645879603d9ab4b45ccb93e5_cover.jpeg","Parsio","A tool to automate data extraction from various files formats.","Productivity","18",""
"https://global-uploads.webflow.com/63994dae1033718bee6949ce/6458795fcba3aa1700b14a3c_thumbnail.png","Samwell","A tool to generate plagiarism essays with AI assistance and MLA references.","Copywriting","11",""
"https://global-uploads.webflow.com/63994dae1033718bee6949ce/6458795e64d8eb4354bba1be_share.jpeg","Drumloop AI","A drum loop generator..","Music","8",""
"https://global-uploads.webflow.com/63994dae1033718bee6949ce/6458795dcba3aa10cab141f3_homepage_og_image_a89de5e0c3.png","VEED","An online video editing platform.","Video Editing","7",""
"https://global-uploads.webflow.com/63994dae1033718bee6949ce/64592f26661554548777db4f_podsqueeze-logo.png","Podsqueeze","A tool for podcast content generation and editing.","Podcasting","8",""
"https://global-uploads.webflow.com/63994dae1033718bee6949ce/6458795c8359638d2802e226_jZXbfZedtLyhbemrmnWkbYBBzI.png","Chadview","A Q&A chatbot for videos.","Chat","4",""
"https://global-uploads.webflow.com/63994dae1033718bee6949ce/6458795b1c94495fb32daed3_https%253A%252F%252Fa7b19d7a245c07286533d7a21bca9acc.cdn.bubble.io%252Ff1683175506399x642153344571672700%252FThumbnail%252520New%252520May%2525204.1.jpeg","AudioPen","A tool to transcribe spoken words into summarized text.","Productivity","12",""
"https://global-uploads.webflow.com/63994dae1033718bee6949ce/6458795b64d8eb5b93bba1af_large-og.png","JediGPT","A chatbot for guidance and advice to help users become a Jedi.","Chat","8",""
"https://global-uploads.webflow.com/63994dae1033718bee6949ce/6458e437ce192e399849aa04_grid-logo.png","GRID","A spreadsheet editor with formula assistance.","Productivity","9",""
"https://global-uploads.webflow.com/63994dae1033718bee6949ce/6458795959cbe77553dfce31_og_image.png","Twelve Labs","A platform provides video search APIs for developers.","AI Detection","6",""
"https://global-uploads.webflow.com/63994dae1033718bee6949ce/6455588c4d8e3f37fbb1def2_Share.jpeg","Cyte","MyCyte is a private, secure, open-source knowledge base that helps you monitor and search your digital history.","Productivity","31",""
"https://global-uploads.webflow.com/63994dae1033718bee6949ce/6456a105f6ba5c710108a94c_muzaic-studio-logo.png","Muzaic Studio","An app to compose soundtrack for videos.","Music","15",""
"https://global-uploads.webflow.com/63994dae1033718bee6949ce/6456a042edfb9f018a1083de_humanfest-chat-logo.png","HumanFest","A tool that connects users to chat with strangers or bots.","Chat","8",""
"https://global-uploads.webflow.com/63994dae1033718bee6949ce/6455588a364802410d91c7d9_SA_FrontRunners_2021.png","Squirrly SEO","An all-in-one SEO suite.","","3",""
"https://global-uploads.webflow.com/63994dae1033718bee6949ce/64555888892c8c6cf812585b_CleanShot-2023-02-13-at-12.02.26.png","Plumy","A tool to create content for Shopify stores.","Marketing","12",""
"https://global-uploads.webflow.com/63994dae1033718bee6949ce/6456955c1709f2518e5cac00_klynk-ai-logo.png","Klynk","A tool to create personalized email campaigns.","Marketing","6",""
"https://global-uploads.webflow.com/63994dae1033718bee6949ce/64540a280c84831a7fa96118_Impossible-Images-Logo-square.png","Impossible Images","A platform to generate images for design and branding.","Generative Art","59",""
"https://global-uploads.webflow.com/63994dae1033718bee6949ce/6454f1a948b6e9f915bac75c_wonderplan-ai-logo.png","Wonderplan","A tool to generate personalised travel plan.","Productivity","20",""
"https://global-uploads.webflow.com/63994dae1033718bee6949ce/64540a27f915a5ea1ce49cab_LGLGrceAqkGWA8BOfyMA4iXOwnA.webp","Noty.ai","A tool for meeting assistance and team collaboration.","Productivity","10",""
"https://global-uploads.webflow.com/63994dae1033718bee6949ce/6454eea5bff4c91d3411744d_heuristi-ca-logo.png","Heuristica","A tool to knowledge exploration for diverse topics.","Research","18",""
"https://global-uploads.webflow.com/63994dae1033718bee6949ce/64540a260e3568846747f4b2_logo.png","AgentRunner.ai","A tool to create and train autonomous AI agents.","Productivity","25",""
"https://global-uploads.webflow.com/63994dae1033718bee6949ce/64540a2512d0f28dd3a0b065_5a374837aab376bb677b3a968c337532ea16f6cb-800x600.png","Cohere","A platform with language tools to build business products.","Research","7",""
"https://global-uploads.webflow.com/63994dae1033718bee6949ce/645498db8d7e0cc00abbd113_vatic-ai-logo.png","Vatic AI","An app to create videos from text.","Text-To-Video","14",""
"https://global-uploads.webflow.com/63994dae1033718bee6949ce/64540a2368458abdf68d36f4_9jI1UWITcw8SzWipQ6cyKXYuQA0.png","Spellpage","A tool to automate tasks.","Productivity","6",""
"https://global-uploads.webflow.com/63994dae1033718bee6949ce/64540a23f2e78f95b3c9b91e_Social-preview-image-1.jpeg","Xinva","A tool to create designs.","Generative Art","18",""
"https://global-uploads.webflow.com/63994dae1033718bee6949ce/6453a55e24da47d9feef5d0e_octoicons-logo.png","Octoicons","A tool to generate custom SVG icons.","Generative Art","10",""
"https://global-uploads.webflow.com/63994dae1033718bee6949ce/6452cc3e4f61ba4e5bd4f35e_opengraph-image.jpeg","Pixelfy","A tool to generate pixel art.","Generative Art","19",""
"https://global-uploads.webflow.com/63994dae1033718bee6949ce/6451e388a06af44f4087c28e_hey-there-share.png","Hey There","An AI assistant with different personas for various tasks.","Productivity","19",""
"https://global-uploads.webflow.com/63994dae1033718bee6949ce/6451e38aca7c95787a6ecff2_tailwind-meta.png","Tailwind","A platform for social media and email marketing.","Marketing","6",""
"https://global-uploads.webflow.com/63994dae1033718bee6949ce/6451e389d5d87071ca3c5bbd_Homepage-min.png","tldv","A platform to record and transcribe online meetings with summarization.","Productivity","10",""
"https://global-uploads.webflow.com/63994dae1033718bee6949ce/6451e387b021790d9a795cc6_og-square.jpeg","ScoreCloud","A software for music notation to convert songs into music sheet.","Music","12",""
"https://global-uploads.webflow.com/63994dae1033718bee6949ce/6451e386ca7c952b9d6ecab2_songr-logo-grey.png","SongR","A tool to generate personalised songs.","Music","32",""
"https://global-uploads.webflow.com/63994dae1033718bee6949ce/64529b11b1a78c975f10864c_templify-ai-logo.png","Templify.ai","A tool for content generation with templates and images.","Copywriting","11",""
"https://global-uploads.webflow.com/63994dae1033718bee6949ce/6452980965404fd5082b44da_quino-ai-logo.png","Quino","A tool to summarize, chat, take notes and test knowledge.","Chat","10",""
"https://global-uploads.webflow.com/63994dae1033718bee6949ce/6452974fe9dcec25a2c72673_pictales-online-logo.png","PicTales","A tool to create stories from images in multiple languages and genres.","Generative Art","27",""
"https://global-uploads.webflow.com/63994dae1033718bee6949ce/6451e383e2ba0ff0b6cd9eb0_https%253A%252F%252Fddc7cc117a233d845226cb3739a847ef.cdn.bubble.io%252Ff1682993350862x683297593506603000%252FFormulas%252520HQ-01.png","Formulas HQ","A tool to generate formulas for various applications and scripts.","Generative Code","2",""
"https://global-uploads.webflow.com/63994dae1033718bee6949ce/64520323497798b46586a04b_twifts-logo.png","Twifts","A gifting assistant based on your tweets.","For Fun","8",""
"https://global-uploads.webflow.com/63994dae1033718bee6949ce/6451e381e6dbd0276ae71b82_jamgpt-preview.png","Jam","A code debugging tool with code analysis and suggestions.","Generative Code","10",""
"https://global-uploads.webflow.com/63994dae1033718bee6949ce/6451e37fc02bf0c464f3d62d_mainpage.png","Midjourney for Slack","A slack bot to generate Midjourney images.","Generative Art","3434",""
"https://global-uploads.webflow.com/63994dae1033718bee6949ce/6450197ca5d2406eed03b8e7_1827de1f-999a-4cbf-94a7-e7ac41abff50.jpeg","CamelAGI","A tool to automate repetitive tasks by deploying ai agents.","Productivity","36",""
"https://global-uploads.webflow.com/63994dae1033718bee6949ce/64516956d624a2aeab2c277e_sloped-xyz-logo.png","Sloped","A tool to transform data queries into shareable dashboards.","Productivity","14",""
"https://global-uploads.webflow.com/63994dae1033718bee6949ce/6451675e1fdf7883fe7f3bf6_myfit-ai-logo.png","MyFit AI","A tool to create personalized fitness programs.","Self-Improvement","26",""
"https://global-uploads.webflow.com/63994dae1033718bee6949ce/6450197adde26001c3ab06fd_pexels-anastasia-shuraeva-4079306-scaled.jpeg","Valossa AI","A tool for audio and video content analysis.","AI Detection","16",""
"https://global-uploads.webflow.com/63994dae1033718bee6949ce/64516b7ad311117f06c08622_chatwithdata-ai-logo.png","Chat With Data","A tool to extract insights and information from various files.","Chat","24",""
"https://global-uploads.webflow.com/63994dae1033718bee6949ce/64501977fc3ae2609220c355_Logo_Blue_Square.png","Procys","A tool to automate data extraction and accounts payable processes.","Productivity","8",""
"https://global-uploads.webflow.com/63994dae1033718bee6949ce/64515c2b2c498af3a8316d84_magify-design-logo.png","Magify.Design","A tool to generate UI/UX designs, code, images, and UX writing.","Generative Code","6",""
"https://global-uploads.webflow.com/63994dae1033718bee6949ce/64515986b73983e456ec75be_narraive-logo.png","Narraive","An interactive storytelling game to become the protagonists of your own stories.","For Fun","13",""
"https://global-uploads.webflow.com/63994dae1033718bee6949ce/641e3e1451f9bc979fd22079_9b4c843d-9fd4-4775-b40f-0d12d7d45720.jpeg","LangGPT","A tool to use ChatGPT in multiple languages.","Translation","19",""
"https://global-uploads.webflow.com/63994dae1033718bee6949ce/6451572dcecf3ff38bbb64ea_educationgenius-io-logo.png","EducationGenius","A platform for educators to create customized educational content.","Productivity","23",""
"https://global-uploads.webflow.com/63994dae1033718bee6949ce/6451551e6765c65639ef1033_deepfakedetector-ai-logo.png","Deepfake Detector","A tool to detect AI-generated deepfakes.","AI Detection","47",""
"https://global-uploads.webflow.com/63994dae1033718bee6949ce/645019722711eb9f6c03acff_StarByFaceLogo.png","Star By Face","A tool to find celebrity look-alike suggestions based on your photo.","AI Detection","31",""
"https://global-uploads.webflow.com/63994dae1033718bee6949ce/64501970d088b79c0793b0d6_card.jpeg","Rapli","A whatsapp bot to generate rap songs.","Music","18",""
"https://global-uploads.webflow.com/63994dae1033718bee6949ce/64501970d088b7bae593b0d1_644c36f708e9487084dba39f_Open%2520Graph.jpeg","PluginLab","A tool for ChatGPT plugin creators to authenticate and plugin analytics.","Productivity","3",""
"https://global-uploads.webflow.com/63994dae1033718bee6949ce/6450196ea2df15c483806610_644a2768744d3189090a0dc3_share-img.jpeg","Guidde","A tool to create video documentations.","Productivity","8",""
"https://global-uploads.webflow.com/63994dae1033718bee6949ce/644ffbfac97b6d14b9491238_ad%20(1).png","Artify","A Suite of Awesome AI Art Tools","Generative Art","241","Image Improvement"
"https://global-uploads.webflow.com/63994dae1033718bee6949ce/644ebe475063be46a3e903fa_dropchat-logo.png","Dropchat","A platform to chat with books and documents.","Chat","24",""
"https://global-uploads.webflow.com/63994dae1033718bee6949ce/644ec01283a43419bfd5665e_3dpresso-ai-logo.png","3DPresso","A platform to extract 3d models from videos and create textures.","Generative Art","29",""
"https://global-uploads.webflow.com/63994dae1033718bee6949ce/644eba0414559b291e22e637_machinetranslation-logo.png","Machine Translation","A tool to compare language translations.","Translation","15",""
"https://global-uploads.webflow.com/63994dae1033718bee6949ce/644ea815352fdd9d1dbc9a2a_protocolpal-app-logo.png","Protocol Pal","A tool for generating common issues list.","Productivity","6",""
"https://global-uploads.webflow.com/63994dae1033718bee6949ce/644d5bba87afef868c90d9c6_magic-todo-logo.png","Magic ToDo","A tool to break down complex tasks into manageable steps.","Productivity","46",""
"https://global-uploads.webflow.com/63994dae1033718bee6949ce/644d593d410fbd1369a933c2_futuredesk-io-logo.png","FutureDesk","A tool with many features to use chatgpt.","Chat","29",""
"https://global-uploads.webflow.com/63994dae1033718bee6949ce/644c3d1c251931dd8db6b0e1_app.png","Docs AI","A tool to create chat support agents and integrate them with websites and Slack.","Chat","8",""
"https://global-uploads.webflow.com/63994dae1033718bee6949ce/644d5676d14b5d5eaab18d9a_kreadoai-logo.png","Kreado AI","A tool to create multilingual language videos.","Avatar","73",""
"https://global-uploads.webflow.com/63994dae1033718bee6949ce/644d4bc9a480f186485d4794_arcwise-logo.png","Arcwise AI","A Google Chrome Extension for google sheets to data analysis.","Productivity","8",""
"https://global-uploads.webflow.com/63994dae1033718bee6949ce/644aeb9a90ccf813fd902b7f_screenshot-2023-04-04-at-53252-pmpng_1680624096_23215.png","CodeDesign.ai","A platform for website building and deployment.","Productivity","44",""
"https://global-uploads.webflow.com/63994dae1033718bee6949ce/644aeb992aa1092790b9df52_Frame-1-5-1.png","Copymate","A tool for SEO content generator in any languages.","Copywriting","6570",""
"https://global-uploads.webflow.com/63994dae1033718bee6949ce/644bc62339f6633e4b16de7d_lettria-logo.png","Lettria","A platform for text to create and deploy NLP projects without coding.","Productivity","5",""
"https://global-uploads.webflow.com/63994dae1033718bee6949ce/644aeb9758b76a3f954225fe_logo-1.png","Mailbutler","A platform to compose, summarize, and organize emails.","Productivity","12",""
"https://global-uploads.webflow.com/63994dae1033718bee6949ce/644aeb962aa10983d6b9dc84_logo.png","Kubee","A tool to create digital avatars.","Avatar","19",""
"https://global-uploads.webflow.com/63994dae1033718bee6949ce/644bbc14fd83bc5bcd39ad22_purplewave-ai-logo.png","Purple Wave","A platform with digital marketing tools.","Marketing","13",""
"https://global-uploads.webflow.com/63994dae1033718bee6949ce/644bbae7f1cff27b91ec89c5_reflectr-ai-logo.png","Reflectr","An app to declutter your mind and a personal notebook.","Productivity","5",""
"https://global-uploads.webflow.com/63994dae1033718bee6949ce/644b74c373801aadea68045f_artificialstudio-ai-logo.png","Artificial Studio","A platform with collection of ai tools to manipulate images, audio, and video.","Image Improvement","45",""
"https://global-uploads.webflow.com/63994dae1033718bee6949ce/644b43e8031e90b8122d2750_callannie-ai-logo.png","Call Annie","An app for video call to learn and befriend.","Chat","22",""
"https://global-uploads.webflow.com/63994dae1033718bee6949ce/644aeb904491ead9b5a95c50_dptqjrCd6Lm3qYH3kYxI4hOVQZoStzRPKLNsg8DveApJ---eIKjGMlfuTF1st4tp7zG0WX5DmVHVaHsqDqegmKhrmA%3Dw128-h128-e365-rj-sc0x00ffffff.jpeg","Liner","A Google Chrome Extension for web insights & curation.","Productivity","8",""
"https://global-uploads.webflow.com/63994dae1033718bee6949ce/644aeb905a83ba8acd979070_seo-image.jpeg","ByeBlankPage.ai","A tool for content generation and writing assistant.","Productivity","15",""
"https://global-uploads.webflow.com/63994dae1033718bee6949ce/644aaef6277a353dc58de202_insight7-io-logo.png","Insight7","A platform for uncovering customer insights.","Research","5",""
"https://global-uploads.webflow.com/63994dae1033718bee6949ce/644b4ae3425b2a40e4f593ff_pineapplebuilder-logo.png","Pineapple Builder","A platform for website building.","Productivity","24",""
"https://global-uploads.webflow.com/63994dae1033718bee6949ce/644a71bf7f605e89c1b392d2_open-gpt-plugin-store-logo.png","Open GPT Plugin Store","A tool to integrate GPT Plugins and AI Agents into chat applications.","Aggregators","46",""
"https://global-uploads.webflow.com/63994dae1033718bee6949ce/644a68a81c65be94b0afddeb_skyglass-logo.png","Skyglass","An app for vfx effects and background for film making.","Generative Video","15",""
"https://global-uploads.webflow.com/63994dae1033718bee6949ce/64485fc3fae35571f541a7cb_2OfzLY23DmeDQVyjuFVnx9kpfEB_0-7.png","Musicfy","A platform to create and discover AI-generated covers and remixes.","Music","63",""
"https://global-uploads.webflow.com/63994dae1033718bee6949ce/64485fc2ac31870c485849f3_opengraph.png","simpler","An AI assistant for productivity.","Productivity","13",""
"https://global-uploads.webflow.com/63994dae1033718bee6949ce/64485fc1dae7de0d35478785_fa4e49dc-446a-4d6f-8a78-42ec097457dd.png","EVITA","A platform for personal singing teacher with tailored vocal exercises and coaching.","Music","13",""
"https://global-uploads.webflow.com/63994dae1033718bee6949ce/64485fc0fae355408041a315_blog-meta-images.png","SpamSpy","A platform to detect spam.","AI Detection","16",""
"https://global-uploads.webflow.com/63994dae1033718bee6949ce/64485fbffae3550b0541a22e_og_logo.png","vidby","A platform for video translation and dubbing.","Translation","15",""
"https://global-uploads.webflow.com/63994dae1033718bee6949ce/6449679bf0776e85453323cb_everbility-logo.png","Everbility","A platform for occupational therapists' documentation assistant.","Productivity","9",""
"https://global-uploads.webflow.com/63994dae1033718bee6949ce/64485fbdac318789c75844bc_1mo8fxakrAsALC2P-JnHkMTb8gyVa7ScrOKxsyH8dUI29fVsNbphSqi4rikeYxkfRFnRe2HF3cudsIzoevkYBe_EqQ%3Dw128-h128-e365-rj-sc0x00ffffff.jpeg","ChatGPT Token Counter","A Google Chrome Extension to track chatgpt tokens count.","Productivity","19",""
"https://global-uploads.webflow.com/63994dae1033718bee6949ce/64485fbcac31873504584436_frame-2-JalJvk.png","Quizbot","A platform to generate quizzes.","Productivity","13",""
"https://global-uploads.webflow.com/63994dae1033718bee6949ce/64496457944d6373f40d89d6_gajix-logo.png","GAJIX","An AI learning assistant with summaries, questions, and productivity.","Productivity","5",""
"https://global-uploads.webflow.com/63994dae1033718bee6949ce/64485fbb812b4eb0db073b88_share.jpeg","Kahuna","A platform to sell subscription services to your expertise and customized trained chatbots.","Chat","9",""
"https://global-uploads.webflow.com/63994dae1033718bee6949ce/6449610d868f4e3fe91a0b8e_chatbot-arena-logo.png","Chatbot Arena","A platform to chat and compare large language models.","Chat","13",""
"https://global-uploads.webflow.com/63994dae1033718bee6949ce/64485fb9ac318777345841d6_opengraph.jpeg","Auto Seduction AI","An app to automate crafting personalized dating messages.","Chat","13",""
"https://global-uploads.webflow.com/63994dae1033718bee6949ce/644801e3a23a062469ff7c7f_gptgo-ai-logo.png","GPTGO","A free search engine integrated with google search results and chatgpt.","Aggregators","54",""
"https://global-uploads.webflow.com/63994dae1033718bee6949ce/6446d39ca68b08a392d4bcc0_TwitterTimeTracking.png","MonitUp","A software for productivity tracking.","Productivity","12",""
"https://global-uploads.webflow.com/63994dae1033718bee6949ce/6446d39a4bb2fa8585da7701_header.png","Quizgecko","Instantly create and share quizzes from any text, file, or web page","Marketing","18",""
"https://global-uploads.webflow.com/63994dae1033718bee6949ce/6446d399a68b08e886d4bcae_open-graph.png","PaletteBrain","A mac app to streamline workflows with chatgpt templates.","Productivity","10",""
"https://global-uploads.webflow.com/63994dae1033718bee6949ce/6446d398aa0877609a1722ac_logo-header-meta.png","Leexi","A platform for sales teams and automate note taking.","Productivity","2",""
"https://global-uploads.webflow.com/63994dae1033718bee6949ce/6446d397aa087797d81722a3_og.png","Regex.ai","A tool to find matching regular expressions.","Productivity","11",""
"https://global-uploads.webflow.com/63994dae1033718bee6949ce/6446d396aa0877822417229b_seo.png","AI Diary","A tool for journaling and personal diary.","Chat","15",""
"https://global-uploads.webflow.com/63994dae1033718bee6949ce/64480f2ec7efcdff41c8c265_her-logo.jpeg","Her","An app to chat for companionship and emotional support.","Chat","22",""
"https://global-uploads.webflow.com/63994dae1033718bee6949ce/64480e3d9047f01859e0e2bc_talkface-ai.webp","Talkface","An app for language learning with personalized curriculum.","Chat","22",""
"https://global-uploads.webflow.com/63994dae1033718bee6949ce/64480c488aaf545877a16fd8_voicify-ai-logo.png","Voicify","A platform to create AI covers of popular artists.","Music","13",""
"https://global-uploads.webflow.com/63994dae1033718bee6949ce/6446d39210576a61b15f6345_assets%252Ffeature2.png","Candlestick","An app for investors to pick stocks.","Finance","26",""
"https://global-uploads.webflow.com/63994dae1033718bee6949ce/644805089d71503e9edcd3a5_chat-with-twitter-logo.png","Chat With Twitter Algorithm","A chatbot provides answers to your questions about twitter algorithm.","Chat","10",""
"https://global-uploads.webflow.com/63994dae1033718bee6949ce/644800940500851ff1aff2a1_gnbly-logo.png","Gnbly","An ai assistant to help with communication and organization.","Productivity","3",""
"https://global-uploads.webflow.com/63994dae1033718bee6949ce/6446c98abf76de555583c9e3_ask-the-oracle-logo.png","Ask the Oracle","A tool for various divination and astrology services.","For Fun","34",""
"https://global-uploads.webflow.com/63994dae1033718bee6949ce/6446c444aa0877fcb10b2c50_honestymeter-com-logo.png","Honesty Meter","A tool to identify potential bias in writing with an objective score.","Research","16",""
"https://global-uploads.webflow.com/63994dae1033718bee6949ce/6446019f586304f4f906c45b_Show-off-your-product-1-e1680275802844.png","Lumiere3D","A tool to edit cinematic shoe videos.","Video Editing","62",""
"https://global-uploads.webflow.com/63994dae1033718bee6949ce/6446019f8c04e97ed26ebb2a_53b81a_fbe354eca349409cad12477d5bc017b2~mv2.png","ProfilePro","A Google Chrome Extension to optimize and manage Google Business Profile.","Marketing","19",""
"https://global-uploads.webflow.com/63994dae1033718bee6949ce/6446bf4da32dc01e7391bdce_nextthreebooks-logo.png","Next Three Books","A tool for personalized book recommendations.","Productivity","19",""
"https://global-uploads.webflow.com/63994dae1033718bee6949ce/6446019eee62e92b065e7ee7_hero-bg.51657b7.webp","Rythmex","A tool to convert audio-to-text.","Speech-To-Text","16",""
"https://global-uploads.webflow.com/63994dae1033718bee6949ce/6445f7a3b272c079065d0c46_CF-Spark-Page.png","CF Spark","A suite of AI art, copywriting, and prompting tools all in one place","Generative Art","25","Copywriting"
"https://global-uploads.webflow.com/63994dae1033718bee6949ce/6442ed863880de4814f7ab8d_2pmbl3X5QdYXNoAVDJBwYqpAvkI.jpeg","Ogimi","A tool for custom guided meditations.","Self-Improvement","26",""
"https://global-uploads.webflow.com/63994dae1033718bee6949ce/6442ed853880de1051f7aadc_AutoGPT.png","AutoGPT (Hugging Face)","A Hugging Face space to use AutoGPT.","Productivity","55",""
"https://global-uploads.webflow.com/63994dae1033718bee6949ce/644574aedea1ba5bcce33fdb_neuralframes-logo.png","Neural Frames","A platform to convert text into video.","Text-To-Video","140",""
"https://global-uploads.webflow.com/63994dae1033718bee6949ce/64456ecdb6331f528ecd6e12_aomni-logo.png","aomni","An AutoGPT ai agent for web data retrieval.","Research","30",""
"https://global-uploads.webflow.com/63994dae1033718bee6949ce/6442ed81833d0975c79b918a_teamsmart-ai.jpeg","TeamSmart AI","A Google Chrome Extension for teams productivity with AI-driven tools.","Productivity","8",""
"https://global-uploads.webflow.com/63994dae1033718bee6949ce/6442ed80f21573218fa3c7a6_https%253A%252F%252Ftechcopilot.cdn.bubble.io%252Ff1682003297993x717276698719839100%252FShare%252520Thumbnail.jpeg","Pace","An ai assistant to generate ideas and requirements.","Productivity","19",""
"https://global-uploads.webflow.com/63994dae1033718bee6949ce/6444384f1ef676eb16605239_adwrite-logo.png","Adwrite","A copywriting tool for marketers.","Marketing","14",""
