"tool_mage_url","tool","tool_description","category","upvotes","tags"
"https://global-uploads.webflow.com/63994dae1033718bee6949ce/6415a91877b9d44702be7e78_catbird-ai-logo.png","Catbird","A tool to generate multiple images from single prompt.","Generative Art","159",""
"https://global-uploads.webflow.com/63994dae1033718bee6949ce/64154da6c0fde4ad5838d856_5f6324b2908e96c6b2a075ce_fx.aifbpost.png","FormX.ai","A tool for data extraction and process physical documents.","AI Detection","27",""
"https://global-uploads.webflow.com/63994dae1033718bee6949ce/6415a8061aea853dfbd205bf_Screen%20Shot%202023-03-18%20at%205.30.41%20PM.png","ListingCopy.ai","A tool to generate description for real estate listings.","Copywriting","19",""
"https://global-uploads.webflow.com/63994dae1033718bee6949ce/64154da4dd1cef5e622fcd45_2MHAQPtLPqoSL9FZlbQx5YN0HOs_cta.png","Sharly AI","A tool to simplify text documents.","Productivity","20",""
"https://global-uploads.webflow.com/63994dae1033718bee6949ce/64154da2c0fde4453a38d846_og.png","InteraxAI","A platform to integrate nocode widgets for monetization.","Productivity","15",""
"https://global-uploads.webflow.com/63994dae1033718bee6949ce/6415a453f57cd4e4976d8e0e_snowpixel-app-logo.webp","Snowpixel","A tool for media manipulation to generate images.","Generative Art","49",""
"https://global-uploads.webflow.com/63994dae1033718bee6949ce/64154da0e084241539836b41_logo.png","Polyhive","A platform for game asset development and management.","Gaming","261",""
"https://global-uploads.webflow.com/63994dae1033718bee6949ce/6413eb4bf481f632df14ca4a_logo512.png","Ask Your PDF","A tool to summarize and interact with PDF files.","Chat","245",""
"https://global-uploads.webflow.com/63994dae1033718bee6949ce/6413eb4aed5be9be4720950a_ContractReader.png","ContractReader.io","A tool to read, understand, and interact with Ethereum smart contracts on the Mainnet.","Finance","22",""
"https://global-uploads.webflow.com/63994dae1033718bee6949ce/64143b64f1727edaaec14431_alta-ai-logo.png","Alta AI","A tool to create personalized mobile app templates.","Productivity","14",""
"https://global-uploads.webflow.com/63994dae1033718bee6949ce/64143a88d8683a36e17ea25f_designerbot-logo.png","DesignerBot","A platform for presentation making.","Productivity","42",""
"https://global-uploads.webflow.com/63994dae1033718bee6949ce/6413eb472b2d6a12147da095_Group-44.png","Vidds.co","A platform for video generation and automation.","Generative Video","147","Text-To-Video"
"https://global-uploads.webflow.com/63994dae1033718bee6949ce/641438fe9c368029e630c17c_commenter-ai-logo.png","Commenter.ai","A tool for automating comment generation.","Social Media","15",""
"https://global-uploads.webflow.com/63994dae1033718bee6949ce/6413eb462b2d6af5b37d9f7d_0xFrancis_minimalist_vector_illustration_of_a_scribe_fox_in_the_82ac4608-c59e-4330-932c-eaebd2559b1e.png","EchoFox","An app for transcription assistant.","Speech-To-Text","29",""
"https://global-uploads.webflow.com/63994dae1033718bee6949ce/6413eb45153e1029eeef2061_Crabo-AI-open-graph.webp","Crabo","A tool to build text and voice chatbot for Telegram.","Chat","9",""
"https://global-uploads.webflow.com/63994dae1033718bee6949ce/6413eb43153e1060e9ef1be3_nvidia-studio-canvas-social-1104x736.jpeg","NVIDIA Canvas","A tool to turn brushstrokes into realistic landscape images.","Generative Art","51","Matt's Picks"
"https://global-uploads.webflow.com/63994dae1033718bee6949ce/641431cc004516835024f578_grambotplus-logo.jpeg","GramBotPlus","A tool to automate Instagram growth.","Social Media","77",""
"https://global-uploads.webflow.com/63994dae1033718bee6949ce/64143102082259244ce4e47a_wordmax-ai-logo.jpeg","Wordmax","A platform to create content.","Productivity","19",""
"https://global-uploads.webflow.com/63994dae1033718bee6949ce/6413eb41a473c4b4fc4cfbab_636e6aa0a814285799789c92_open-graph.png","Zevi","A platform to create discovery solutions for Shopify stores.","Marketing","13",""
"https://global-uploads.webflow.com/63994dae1033718bee6949ce/64142fe046f1d2fe0528b0aa_chatdoc-logo.webp","ChatDOC","A tool to summarize PDF files.","Productivity","1476",""
"https://global-uploads.webflow.com/63994dae1033718bee6949ce/6413eb3f644dcd5b69a6a4c9_cover.png","ePromptly","A platform to generate, buy and sell prompts.","Prompt Guides","19",""
"https://global-uploads.webflow.com/63994dae1033718bee6949ce/64142a9bb48c13c0ff1bfc3b_plazmapunk-logo.png","Plazmapunk","A tool to generate music video from a song.","Generative Video","105","Matt's Picks"
"https://global-uploads.webflow.com/63994dae1033718bee6949ce/6413eb3d153e101debef1198_open-graph.jpeg","Text With Chat GPT","A chatbot to communicate with AI via text message for free.","Chat","58",""
"https://global-uploads.webflow.com/63994dae1033718bee6949ce/64142964cc1d0db371f025e0_scrivvy-ai-logo.png","Scrivvy","A tool to summarize YouTube videos.","Productivity","27",""
"https://global-uploads.webflow.com/63994dae1033718bee6949ce/64141652cf83db2ec92ee9c7_fontis-ai-logo.png","Fontis.ai","A platform to create and buy ai artwork.","Generative Art","18",""
"https://global-uploads.webflow.com/63994dae1033718bee6949ce/6413442cdc781473230ad9e1_spellbound-cc-logo.png","SpellBound","A mac app for AI writing assistant.","Productivity","14",""
"https://global-uploads.webflow.com/63994dae1033718bee6949ce/64123c1e2e8eb98ed18d97e1_BME-illustration-tagline-01.png","Be My Eyes","A free app for blind people to get visual assistance.","AI Detection","27",""
"https://global-uploads.webflow.com/63994dae1033718bee6949ce/64131cd09909d35799de0ede_prompt-journey-logo.png","Prompt-Journey","A tool to customize midjourney prompts.","Prompt Guides","34",""
"https://global-uploads.webflow.com/63994dae1033718bee6949ce/64123c18e6f597383d5424d2_capturelab-meta-image.jpeg","Capturelab","A free tool to automatically detect highlights and create gaming clips from streams.","Gaming","949",""
"https://global-uploads.webflow.com/63994dae1033718bee6949ce/6413204f1b9d5d7b3d54e364_illuminarty-ai-logo.png","Illuminarty","A tool for detecting AI generated images.","AI Detection","36",""
"https://global-uploads.webflow.com/63994dae1033718bee6949ce/64134760281e8a4df38537e7_linkedin-manager-logo.png","Linkedin Manager","A tool for recruiters.","Social Media","6",""
"https://global-uploads.webflow.com/63994dae1033718bee6949ce/64123c276fd0df88eeb4387a_taplio_meta.jpeg","Taplio","A tool for creating and managing LinkedIn content.","Social Media","15",""
"https://global-uploads.webflow.com/63994dae1033718bee6949ce/64123c26bef457ca6295c0f1_468ca4_022a962797694bf19d24cb434ad5231d%257Emv2.png","Venturefy","A tool to verify corporate proof to increase trust with customers.","Research","120",""
"https://global-uploads.webflow.com/63994dae1033718bee6949ce/6413450bc418f0ca03cbf2cc_victor-logo.png","Victor","A Google Chrome Extension to automate emails.","Productivity","7",""
"https://global-uploads.webflow.com/63994dae1033718bee6949ce/641342f89f8524e5fcb0e8db_jason-ai-tech-logo.png","Jason AI","A tool for automating B2B conversations and bookings.","Marketing","9",""
"https://global-uploads.webflow.com/63994dae1033718bee6949ce/64123c24f86231150b4d840a_thedreamia.jpeg","TheDream.ai","A tool to create profile pictures for social media.","Image Improvement","107",""
"https://global-uploads.webflow.com/63994dae1033718bee6949ce/64123c236fd0df8282b4386b_1200x630wa.png","StoryAI","An app to discover and read AI-generated stories.","Productivity","17",""
"https://global-uploads.webflow.com/63994dae1033718bee6949ce/64123c220ff79f1468161ccb_1200x630wa.png","Puppetry","A free animation app.","Productivity","86",""
"https://global-uploads.webflow.com/63994dae1033718bee6949ce/64133d447c9b5ecd1ca8ce86_assisterr-xyz-logo.png","Assisterr","A platform for web3 analytics.","Marketing","4",""
"https://global-uploads.webflow.com/63994dae1033718bee6949ce/64123c1fbef457dba595b9cc_og-image.png","Chatfuel AI","A chatbot builder.","Chat","17",""
"https://global-uploads.webflow.com/63994dae1033718bee6949ce/64123c1ff862319f204d7e04_dc35d2148403f6050217a38032fdc193077185fd-1246x1136.png","Collato","A search engine for product teams.","Productivity","2",""
"https://global-uploads.webflow.com/63994dae1033718bee6949ce/64123c1dbef4577ccb95b71f_preview-img.png","Collie","A tool to create embedded search for any website.","Productivity","8",""
"https://global-uploads.webflow.com/63994dae1033718bee6949ce/64123c1cf8623134f64d79cc_autoblocks-landing-page.png","Autoblocks AI","A tool to build, deploy, and monitor LLMs.","Productivity","6",""
"https://global-uploads.webflow.com/63994dae1033718bee6949ce/64123c1be6f59712f65427b9_khan-logo-dark-background-2.png","Khan Academy","A tool for personalized tutoring guides.","Research","19",""
"https://global-uploads.webflow.com/63994dae1033718bee6949ce/64123c1b3953312ecdc898ef_asknotion.png","AskNotion","A tool to build chatbot using Notion Pages.","Chat","25",""
"https://global-uploads.webflow.com/63994dae1033718bee6949ce/64123c1a6fd0df92fcb4384b_sitepicture.png","LogoCreatorAI","A tool for logo designs.","Marketing","46",""
"https://global-uploads.webflow.com/63994dae1033718bee6949ce/64131b30cbbc5b3945033c1c_seo-gpt-logo.png","SEO GPT","A tool for free content generatoration.","Marketing","91",""
"https://global-uploads.webflow.com/63994dae1033718bee6949ce/641319b4c5e82ae091423f5f_glarity-app-logo.jpeg","Glarity","A browser extension for summaries for Google and YouTube.","Productivity","31",""
"https://global-uploads.webflow.com/63994dae1033718bee6949ce/641155de5904a7744dcc7d88_static%252Fassets%252Fimg%252Fmobile_gpt_stuff.jpeg","Mobile GPT","An app for ai assistant on Whatsapp.","Chat","38",""
"https://global-uploads.webflow.com/63994dae1033718bee6949ce/641155dc5904a7024acc7d85_6406e2f4bb4a9917541fd058_Relume%2520Ipsum%2520Open%2520Graph.png","Relume Ipsum","A tool for to generate copy without leaving Figma.","Productivity","4",""
"https://global-uploads.webflow.com/63994dae1033718bee6949ce/641155dc5904a703dbcc7d80_63a1278018ceba3c39db15f9_%25ED%2599%2588%25ED%258E%2598%25EC%259D%25B4%25EC%25A7%2580_Main_Best-virtual_1.png","DeepBrain AI","A tool to create text-to-speech videos.","Text-To-Video","108","Avatar"
"https://global-uploads.webflow.com/63994dae1033718bee6949ce/641189aed512fdbe67a5f833_dime-a-dozen-ai-logo.png","Dime A Dozen","A tool to validate business ideas.","Research","33",""
"https://global-uploads.webflow.com/63994dae1033718bee6949ce/641155dadd37a9af96875809_og.jpeg","swiftGPT.app","A free macOS app for fast ChatGPT experience.","Productivity","23",""
"https://global-uploads.webflow.com/63994dae1033718bee6949ce/641155d9dd37a9e58a8756be_6408c8c37a302620e14cc66d_Image.png","AI Product Photos","A tool to generate product photos.","Generative Art","31",""
"https://global-uploads.webflow.com/63994dae1033718bee6949ce/641155d847b182170b018f60_63f65739330fa005a61a45ed_Feature%2520Image.png","Promptitude.io","A tool for integrating GPT with a library of prompts.","Productivity","9",""
"https://global-uploads.webflow.com/63994dae1033718bee6949ce/64118660e9fc5391742100e9_ellisense-logo.png","Ellisense","A software for comprehensive market sentiment analysis.","Finance","65",""
"https://global-uploads.webflow.com/63994dae1033718bee6949ce/641184e71dad802ed7e91a88_spacely-ai-logo.png","Spacely.ai","A tool for interior design.","Generative Art","27",""
"https://global-uploads.webflow.com/63994dae1033718bee6949ce/641155d65904a767c4cc7d70_ai-studio-by-blend.webp","Blend AI Studio","A tool for creating professional product photos.","Generative Art","16",""
"https://global-uploads.webflow.com/63994dae1033718bee6949ce/641181760a14219b9db8f343_aigallery-app-logo.png","AI Gallery","An interactive tool to generate images.","Generative Art","58",""
"https://global-uploads.webflow.com/63994dae1033718bee6949ce/64117a643eb50b7864ea3371_venturus-ai-logo.png","VenturusAI","A tool for instant feedback and analysis on business ideas.","Marketing","73",""
"https://global-uploads.webflow.com/63994dae1033718bee6949ce/64117866df6a2d3f7e422fc5_aidev-codes-logo.png","AIDev.Codes","A tool to create custom webpages with text generation.","Generative Code","31",""
"https://global-uploads.webflow.com/63994dae1033718bee6949ce/641155d1039fe00c5ead9d73_default-og.jpeg","Skybox Lab","A free research tool to create panoramic skyboxes.","Generative Art","60","Gaming"
"https://global-uploads.webflow.com/63994dae1033718bee6949ce/64116fe609540a7d33fa39af_ai-chat-bestie-logo.png","AI Chat Bestie","A tool for chatgpt faster responses and searchable chat history.","Productivity","26",""
"https://global-uploads.webflow.com/63994dae1033718bee6949ce/64116e0656bd3f9e91ebe9d9_wisio-app-logo.png","Wisio","A platform for scientific writing.","Research","32",""
"https://global-uploads.webflow.com/63994dae1033718bee6949ce/641155ce5904a7d6a9cc7d3a_KAZWyMNHsPl60SntCsvMhuomePSPw_TkHTZ4aWYAx4hFuewop9FXQup3XfsU9SLiXudRRzoGmBJpTSM_mhd868XiWg%3Dw128-h128-e365-rj-sc0x00ffffff.jpeg","Superpower GPT","A Google Chrome Extension to add extra functionality to chatgpt.","Productivity","116",""
"https://global-uploads.webflow.com/63994dae1033718bee6949ce/64107555b946b862c4bb0488_hereafter-ai-logo.webp","HereAfter AI","An app to create, preserve, and share memories.","Chat","11",""
"https://global-uploads.webflow.com/63994dae1033718bee6949ce/6410740f08a3a16fc6e4ea61_applai-me-logo.png","Applai.me","A platform for job preparation and cv optimization.","Productivity","23",""
"https://global-uploads.webflow.com/63994dae1033718bee6949ce/64106f916732cccc3f1d1e47_midi-gpt-logo.png","MIDI-GPT","A tool to generate MIDI files using Chatgpt.","Music","54",""
"https://global-uploads.webflow.com/63994dae1033718bee6949ce/64106daacd5c081af520f9ae_brainfever-ai-logo.jpeg","BrainFever","An app for text-to-image generation and advanced photo editing.","Generative Art","39",""
"https://global-uploads.webflow.com/63994dae1033718bee6949ce/64106c3481d302b2de853bac_seashore-ai-logo.png","Seashore.AI","A platform to create chatbots for sales and customer service.","Chat","29",""
"https://global-uploads.webflow.com/63994dae1033718bee6949ce/64106ac31fc548866b12150d_treebrain-ai-logo.png","TreeBrain","A platform to generate content in over 30 languages.","Marketing","172",""
"https://global-uploads.webflow.com/63994dae1033718bee6949ce/640f6ca0729e083a0959052e_d2tmcmNTBbO4csFK-dUTXUo2nA4ApFKC92nMjh8Vs616v1QSmzpZE2DHUXbCZKXk-7c9dBGQb2h53IU5rrdKlyV77w%3Dw128-h128-e365-rj-sc0x00ffffff.jpeg","Youtube Transcript AI Summary","A Google Chrome Extension to summarize youtube transcripts.","Productivity","18",""
"https://global-uploads.webflow.com/63994dae1033718bee6949ce/641068c2b782d7628fd6f0ff_majorgen-logo.png","MajorGen","A tool to create resumes and cover letters from profiles.","Productivity","140",""
"https://global-uploads.webflow.com/63994dae1033718bee6949ce/6410677806afb82abe5004de_transpic-cn-logo.png","Transpic","A tool to customize the effects of images transfer guide.","Image Improvement","84",""
"https://global-uploads.webflow.com/63994dae1033718bee6949ce/640f6c9e3fb0582a15692b16_og_logo.jpeg","BeeHelp Assistant","A tool to create chatbots for customer service.","Chat","8",""
"https://global-uploads.webflow.com/63994dae1033718bee6949ce/640f6c9d933ffa667f0fca57_card.png","Zev","A chabot for LINE, Telegram and Viber apps.","Chat","11",""
"https://global-uploads.webflow.com/63994dae1033718bee6949ce/640f6c9cea58f240fc002f74_xq8F77lMf895mb2eAIWYmK5qNeA.png","Vid2Txt","A software to generate text, srt, and vtt files from video and audio files.","Productivity","17",""
"https://global-uploads.webflow.com/63994dae1033718bee6949ce/64105efe446e1552871ab5d4_keywordspy-logo.png","KeywordSpy","A tool for seo content relevance optimization.","Marketing","9",""
"https://global-uploads.webflow.com/63994dae1033718bee6949ce/640f6c9a2d538600593824bf_859bf7021400f4d560cd6d80e505bada.png","Mails.ai","A platform for email marketing.","Marketing","95",""
"https://global-uploads.webflow.com/63994dae1033718bee6949ce/640d46d350786e0e6ca97a3b_humanimg2.webp","Revoicer","A tool for creating text-to-speech and voice-overs.","Text-To-Speech","63",""
"https://global-uploads.webflow.com/63994dae1033718bee6949ce/640d46d3d2dc3b02cdeb04fe_leaf-1.png","Symptom Checker AI","A tool to check medical symptoms.","Self-Improvement","232",""
"https://global-uploads.webflow.com/63994dae1033718bee6949ce/640d46d2d2dc3b2e21eb04fb_features-poster-desktop.png","FAQx","An app to search verified answers.","Aggregators","22",""
"https://global-uploads.webflow.com/63994dae1033718bee6949ce/640dda78012aac6e223cb356_geniea-com-logo.png","Geniea","A tool for midjourney prompt optimization.","Prompt Guides","45",""
"https://global-uploads.webflow.com/63994dae1033718bee6949ce/640dd89d8bee98451dfe2070_nat-dev-logo.png","OpenPlayground Compare","A tool to compare different language models.","Research","35",""
"https://global-uploads.webflow.com/63994dae1033718bee6949ce/640bd25a3aebab8c44ad9dd9_63a657839e8536978bb228f4_embthumb.png","Embolden","A platform for writing content.","Marketing","25",""
"https://global-uploads.webflow.com/63994dae1033718bee6949ce/640c6b1ebe431259be1a48af_censusgpt-logo.png","Census GPT","A tool for US demographics and statics.","Research","28",""
"https://global-uploads.webflow.com/63994dae1033718bee6949ce/640bd259cfa3621a8a4c9def_getbotz-og-1024x616.png","GetBotz","A platform for writing, optimization, and submission of articles.","Marketing","22",""
"https://global-uploads.webflow.com/63994dae1033718bee6949ce/640bd258c7be9bf6491c3193_social-card-2.png","Imaginary Programming","A tool for frontend developers.","Productivity","17",""
"https://global-uploads.webflow.com/63994dae1033718bee6949ce/640c677776d5c09965077e10_writemage-logo.png","WriteMage","A tool to integrate chatgpt on Mac and iOs.","Productivity","18",""
"https://global-uploads.webflow.com/63994dae1033718bee6949ce/640bd257c7be9b175c1c2eff_SocialBees-AI-social-media-post-generator.png","SocialBee","A platform for social media content generation.","Social Media","50",""
"https://global-uploads.webflow.com/63994dae1033718bee6949ce/640bd256e4b2074d8da052c3_miro.png","Miro AI","A tool for teams management.","Productivity","13",""
"https://global-uploads.webflow.com/63994dae1033718bee6949ce/640bd2553aebab6d74ad9a37_5404036.png","MaiMovie","An app for movie and TV show search.","For Fun","51",""
"https://global-uploads.webflow.com/63994dae1033718bee6949ce/640c624e2a101ad73d5133fd_codeassist-tech-logo.png","CodeAssist","A chatbot to generate code completions.","Productivity","8",""
"https://global-uploads.webflow.com/63994dae1033718bee6949ce/640c61722a101acc2850e297_mottle-logo.png","Mottle","A tool for chatbot building.","Chat","9",""
"https://global-uploads.webflow.com/63994dae1033718bee6949ce/640bd252cfa36240fc4c97d0_myroomdesigner.png","MyRoomDesigner.ai","A tool for interior design.","Generative Art","67",""
"https://global-uploads.webflow.com/63994dae1033718bee6949ce/640c59d5f206c25e169eef7b_lxi-ai-logo.png","lxi.ai","A tool to create custom question answering bot.","Productivity","10",""
"https://global-uploads.webflow.com/63994dae1033718bee6949ce/640bd2503aebabf296ad9688_teriyaki-editor-newsletter-ai-1-1024x432.png","InfoMail","A platform for email marketing","Marketing","8",""
"https://global-uploads.webflow.com/63994dae1033718bee6949ce/640bd24f991723a86ab6f15f_poster.png","GPT95","A VSCode extension for code generation.","Productivity","14",""
"https://global-uploads.webflow.com/63994dae1033718bee6949ce/640c574472e3d9fdd00013e0_autopia-labs-logo.png","Autopia Labs","A platform for workflow automation.","Productivity","3",""
"https://global-uploads.webflow.com/63994dae1033718bee6949ce/640c566b72e3d96231fe6e60_zeemo-ai-logo.png","Zeemo AI","An app for generating subtitles in 17 languages.","Translation","24",""
"https://global-uploads.webflow.com/63994dae1033718bee6949ce/640c55bfee255aca857c767a_easyprompt-xyz-logo.png","Easy Prompt","A telegram bot for prompt generation.","Prompt Guides","16",""
"https://global-uploads.webflow.com/63994dae1033718bee6949ce/640b7b0885f0c021e291396a_header_graphic_01-1.png","Wonder Dynamics","Quickly animate, light, and compose CG characters into a live-action scene","Generative Video","226","Video Editing"
"https://global-uploads.webflow.com/63994dae1033718bee6949ce/640a89bcc0a59a55e0689471_https%253A%252F%252Fs3.amazonaws.com%252Fappforest_uf%252Ff1634182883800x986165086414297500%252FExport.png","Validly","A platform for product interviews and insights.","Productivity","15",""
"https://global-uploads.webflow.com/63994dae1033718bee6949ce/640a89bb83bae80b8a816738_64090b0ebf69624aa812a00d_second-og.png","Second Home","A platform that creates bots to write code.","Productivity","16",""
"https://global-uploads.webflow.com/63994dae1033718bee6949ce/640b21cade41c8b443ddc9db_rhetorai-logo.png","RhetorAI","A platform to create user interviews for product feedbacks.","Marketing","21",""
"https://global-uploads.webflow.com/63994dae1033718bee6949ce/640a89b9c0a59a804e6892c1_thumb.jpeg","Replix.ai","A browser extension as content suite.","Marketing","12",""
"https://global-uploads.webflow.com/63994dae1033718bee6949ce/640b1fd31bb996642f49cf8d_paymefy-logo.png","Paymefy","A tool for debt collection.","Finance","23",""
"https://global-uploads.webflow.com/63994dae1033718bee6949ce/640a89b6a8c4f629820420d8_41e3d6a8-d5c9-4c19-97c1-ef9ed43f5670_home_hero_screenshot.jpeg","MeyaGPT","A platform to create chatbots.","Chat","13",""
"https://global-uploads.webflow.com/63994dae1033718bee6949ce/642a596c99a0eb14bcd3f379_Article%20summarizer.png","WebMagic AI","Quickly summarize large amounts of text into shorter versions","Productivity","44",""
"https://global-uploads.webflow.com/63994dae1033718bee6949ce/640b1ced7c24cb3bd984dbaa_fabrie-logo.jpg","Fabrie","A design sandbox to create canvas and prototyping.","Productivity","13",""
"https://global-uploads.webflow.com/63994dae1033718bee6949ce/640b1bd71bb9966b21477a76_virtualface-app-logo.jpeg","Virtual Face","A tool to generate profile pictures for LinkedIn.","Image Improvement","130",""
"https://global-uploads.webflow.com/63994dae1033718bee6949ce/640a89b283bae840bd816250_613b77387ccfb81b26ec5d76_open_graph_v1.png","Super.AI","A platform to process documents.","Productivity","11",""
"https://global-uploads.webflow.com/63994dae1033718bee6949ce/640b1a6e69d0337e3a2f7dbe_swapface-logo.jpg","Swapface","A windows software for creating realistic face swaps.","Video Editing","181",""
"https://global-uploads.webflow.com/63994dae1033718bee6949ce/640a89b1a8c4f6e0b204188c_PN63CCOPK8zVPfaQ9ARrqRhtDJQ.png","Ravyn","A platform for sales and CRM.","Marketing","10",""
"https://global-uploads.webflow.com/63994dae1033718bee6949ce/640a89b053c4b5f7387faf5f_banner.png","PromptPerfect","A tool to optimize prompts.","Prompt Guides","24",""
"https://global-uploads.webflow.com/63994dae1033718bee6949ce/640b0f467e65d42e6db74cd0_openl-io-logo.png","OpenL","A tool for translation.","Translation","29",""
"https://global-uploads.webflow.com/63994dae1033718bee6949ce/640a89afe75ea8478c2ef402_og.png","MealGenie","A tool for vegan recipes discovery.","For Fun","24",""
"https://global-uploads.webflow.com/63994dae1033718bee6949ce/640a89ae1fe75a0071631b49_ui--logo.png","Juji","A platform to create chatbots.","Chat","9",""
"https://global-uploads.webflow.com/63994dae1033718bee6949ce/640a89acc8470c3ea4a24f5e_preview.png","CaptionGen","A tool to generate humorous captions.","Marketing","51",""
"https://global-uploads.webflow.com/63994dae1033718bee6949ce/640a89aa33b878088f74d0ed_1200x630wa.png","Genius Ai","An app for typing assistance.","Productivity","29",""
"https://global-uploads.webflow.com/63994dae1033718bee6949ce/640a89a901763ab3f1ac6b6d_header_photo_tw_header_logomark.png","AnyWebsite.AI","A tool to create and integrate a customizable chatbot.","Chat","10",""
"https://global-uploads.webflow.com/63994dae1033718bee6949ce/640a89a73284e237b660cb4f_team_all.jpeg","Content Marketing At Scale","A platform for content generation.","Marketing","11",""
"https://global-uploads.webflow.com/63994dae1033718bee6949ce/640a7b309b092a9365854d40_Frame%201510.png","Magical","Manage meetings, scheduling, and notes directly from browser tabs","Productivity","37",""
"https://global-uploads.webflow.com/63994dae1033718bee6949ce/6409ad564d7fe509a54b23e2_mapdeduce-logo.png","MapDeduce","A tool to summarize pdf files.","Productivity","49",""
"https://global-uploads.webflow.com/63994dae1033718bee6949ce/640933c8f6fdae439c60d98f_grammar-gpt-banner.png","Grammar GPT","A tool for writing and editing assistant.","Productivity","101",""
"https://global-uploads.webflow.com/63994dae1033718bee6949ce/640933c7b53c4885f66d082f_63f65b92771b535aadbcebb6_section2.png","Momentum","A platform for workflow automation.","Marketing","7",""
"https://global-uploads.webflow.com/63994dae1033718bee6949ce/640933c69228acc8f06cdad7_QyJAK9R7Lscvm3MQ1B0TFICDy_V5Le2EDYCDor5sDfFABu5Hm0Kh6vCZ8vMN5t4V9k0tbXj1MRaKiaXNWjcJciQh540%3Dw128-h128-e365-rj-sc0x00ffffff.jpeg","FinalScout","A Google Chrome Extension to find linkedin emails.","Marketing","8",""
"https://global-uploads.webflow.com/63994dae1033718bee6949ce/640933c5b53c485f826d0405_d15abcaa-e843-41f2-80c9-8529d221a5fb.png","AI-Lawyer","A tool to automate legal document generation","Productivity","22",""
"https://global-uploads.webflow.com/63994dae1033718bee6949ce/640933c49228acfbe26cd9e1_ludo-blue.png","Ludo","A platform to create and research game trends.","Gaming","21",""
"https://global-uploads.webflow.com/63994dae1033718bee6949ce/640933c3f6fdae58f560d471_meta.png","Logoscapes","A tool to create logos.","Generative Art","25",""
"https://global-uploads.webflow.com/63994dae1033718bee6949ce/640933c28f687e12d454bcb1_meta-image.png","IMI Prompt","A tool to generate midjourney prompts.","Prompt Guides","78",""
