"tool_mage_url","tool","tool_description","category","upvotes","tags"
"https://global-uploads.webflow.com/63994dae1033718bee6949ce/63eec916bab0e0d965d24cb1_6364ed89c013580df03b7501_OGP%2520(3).png","Captions","A creators studio app to record, caption, customize, and share videos.","Social Media","48",""
"https://global-uploads.webflow.com/63994dae1033718bee6949ce/63ef3854838e865940d58153_listgpt-logo.png","ListGPT","A Google Chrome Extension to save and share ChatGPT conversations, prompts library, and export messages as text files.","Productivity","13",""
"https://global-uploads.webflow.com/63994dae1033718bee6949ce/63eec9153881fa0869dfa49d_og-image.png","Ghostwriter","A coding tool to debug, refactor, auto-complete suggestions, error detection and fixes, and a chatbot.","Productivity","10",""
"https://global-uploads.webflow.com/63994dae1033718bee6949ce/63ef32a88b10b3814d617a29_editgpt-logo.png","editGPT","An extension for Browsers to proofread, edit, track changes to their content.","Productivity","15",""
"https://global-uploads.webflow.com/63994dae1033718bee6949ce/63ef2f85be14bcb83117b0a3_watchthis-logo.png","WatchThis.dev","A tool for curating entertainment recommendations based on preferences.","For Fun","16",""
"https://global-uploads.webflow.com/63994dae1033718bee6949ce/63eec913df1e9a17b2515d94_iJeMAC4QPIfoF8I5sIiSsneTC0-Y4-TASFia5YMJGOJNJ2dxwQyIzk3DDGjtsz4exd8I7G2Ct8x-IhxAhhUCoJKo%3Dw128-h128-e365-rj-sc0x00ffffff.jpeg","Casper AI","A Google Chrome Extension to summarizing articles, creating content and sharing insights.","Productivity","47",""
"https://global-uploads.webflow.com/63994dae1033718bee6949ce/63eec91200a24000df76b19a_https%253A%252F%252Fs3.amazonaws.com%252Fappforest_uf%252Ff1676502265442x685443462224108200%252F1600x1200.jpeg","Write Panda","A app with AI Writing Assistant for Mac.","Productivity","4",""
"https://global-uploads.webflow.com/63994dae1033718bee6949ce/63ef2a7d838e864a9bc855a4_roryapp-logo.png","Rory","An app to create personalised bedtime stories.","For Fun","31",""
"https://global-uploads.webflow.com/63994dae1033718bee6949ce/63eec91058ebc36f4e616fe5_63e9bfc08b497e62f95b6347_Simulator%2520Screen%2520Shot%2520-%2520iPhone%252014%2520Plus%2520-%25202023-02-12%2520at%252011.31.01-p-500.png","Cassette AI","An app for music creation to generate custom, royalty-free music tracks.","Music","52",""
"https://global-uploads.webflow.com/63994dae1033718bee6949ce/63ef264839dcd76957dd0915_talefactory-logo.png","Tales Factory","A tool to create custom story books with illustrations and narration.","Generative Art","67",""
"https://global-uploads.webflow.com/63994dae1033718bee6949ce/63ef22f8dcc1453319f0b6f7_aiprm-logo.jpeg","AIPRM","A Google Chrome Extension for seo, marketing, art, SaaS, programming chatgpt prompts.","Marketing","95","Prompt Guides"
"https://global-uploads.webflow.com/63994dae1033718bee6949ce/63ed500b32e9a02c04f1dafa_og-image.7ca513e.png","TinyForest","A platform for writing tools .","Copywriting","28",""
"https://global-uploads.webflow.com/63994dae1033718bee6949ce/63ed50093e648683f0a45694_og.png","Inngest","A tool for personalized documentation and personalized code examples for scheduling serverless functions.","Productivity","10",""
"https://global-uploads.webflow.com/63994dae1033718bee6949ce/63ed5009d6839bc77069f4e8_example.png","Fantoons","A tool for creating harry potter fan comics and stories.","For Fun","53",""
"https://global-uploads.webflow.com/63994dae1033718bee6949ce/63ed5008ac3cc11c61d479eb_63dea3e910d0b91a93407fe0_hero-beta-2.png","Light","An assistant tool to automate and perform mundane tasks.","Productivity","15",""
"https://global-uploads.webflow.com/63994dae1033718bee6949ce/63edf91dc30ebe7721b908de_kartiv-logo.png","Kartiv","A tool to create visuals from your own photos and brand assets.","Productivity","56",""
"https://global-uploads.webflow.com/63994dae1033718bee6949ce/63ed500532e9a00a89f1d49c_6177efb52a6e1a0137db6d66_Huru%2527s%2520Home%2520Screen.png","Huru","A job interview preparation mobile app for candidates and students practice interviews.","Productivity","9",""
"https://global-uploads.webflow.com/63994dae1033718bee6949ce/63edf664f89359422efb5683_golden-chat-logo.png","Golden Chat","A toolkit for creators, copywriters, and human rewriter.","Copywriting","15",""
"https://global-uploads.webflow.com/63994dae1033718bee6949ce/63ed500362b15fab6f7e787e_5QZQMvdwnAMtzr2kQjumdy6194lIo8yKXQYMHpZ-SmHM5EKM5GKgc5mWEKEmhFvEv9lhLMszlhFVrU54AVo8D-oCYA%3Dw128-h128-e365-rj-sc0x00ffffff.jpeg","writeGPT","A Google Chrome Extension to add GPT3.5 capabilities on any website and prompt writing helper.","Prompt Guides","51",""
"https://global-uploads.webflow.com/63994dae1033718bee6949ce/63ed5002df6b85597f43e557_best-photo-editor-cover.jpeg","Pixlr","A tool for photo creating, editing and design.","Image Improvement","47",""
"https://global-uploads.webflow.com/63994dae1033718bee6949ce/63edf365149919805a78f2c0_analogenie-logo.png","analogenie","A tool to write creative analogies and metaphors.","Prompt Guides","16",""
"https://global-uploads.webflow.com/63994dae1033718bee6949ce/63ed5001abd4190d2608d330_og.png","GitFluence","A tool to get git command for any task.","Prompt Guides","33",""
"https://global-uploads.webflow.com/63994dae1033718bee6949ce/63ed4fffb8dc213c73ba3efe_63ec8e39f3741a4d63b210b3_ChatGPT%2520eCom%2520Prompts.png","eCommerce ChatGPT Prompts","A tool that generates personalized ecommerce store and marketing content.","Prompt Guides","42",""
"https://global-uploads.webflow.com/63994dae1033718bee6949ce/63ed4ffef240fdd8bc9bd3ec_photo-1531746790731-6c087fecd65a.jpeg","Programming Helper","A tool to help you with programming, debugging, and other such tasks.","Productivity","35",""
"https://global-uploads.webflow.com/63994dae1033718bee6949ce/63ed4ffd6624e1b6d235c865_social-gradient.png","Humanloop","A SDK to customize GPT-3 language models and collect end-user feedback.","Prompt Guides","9",""
"https://global-uploads.webflow.com/63994dae1033718bee6949ce/63ed4ffc4abd442985078090_cover.png","novelistAI","A story-writing platform to create personalized stories and interactive books.","Productivity","24",""
"https://global-uploads.webflow.com/63994dae1033718bee6949ce/63ed4ffb6c96ba55ecf82a19_sonix-share-image.jpeg","Sonix","A tool for transcription, translation, and subtitling.","Podcasting","38","Translation"
"https://global-uploads.webflow.com/63994dae1033718bee6949ce/63eddcdec10119f7133e8ae6_dimensions-ink-logo.png","Dimensions","A tool for games assets builder.","Gaming","15",""
"https://global-uploads.webflow.com/63994dae1033718bee6949ce/63eddad8918b11dd3a701fa3_kanaries-logo.png","Kanaries","A suite of tools for augmented analytics data exploration, visual analytics, and data wrangling for insights.","Productivity","7",""
"https://global-uploads.webflow.com/63994dae1033718bee6949ce/63edd84de536316188911fbd_hitpaw-watermark-remover-logo.png","HitPaw Watermark Remover","A tool for removing watermarks from images and videos.","Image Improvement","93",""
"https://global-uploads.webflow.com/63994dae1033718bee6949ce/63edd7351c9b76726ef36ebe_hitpaw-video-enhancer-logo.png","HitPaw Video Enhancer","A software for video enhancement to repair and improve video quality up to 8K resolution.","Video Editing","129",""
"https://global-uploads.webflow.com/63994dae1033718bee6949ce/63edd5db8af25a0a4633845c_hitpaw-photo-enhancer-logo.png","HitPaw Photo Enhancer","A software for improving image quality and resolution.","Image Improvement","102",""
"https://global-uploads.webflow.com/63994dae1033718bee6949ce/63edd519729885620f38cef6_nanonets-logo.png","Nanonets","A tool to capturing data from documents and automate manual data entry work .","Productivity","10",""
"https://global-uploads.webflow.com/63994dae1033718bee6949ce/63ed4ff63634a3e9aa629f1f_apple-touch-icon.png","FakeYou","A deep fake tool to generate audio clips of text-to-speech in multiple languages and voices.","Text-To-Speech","97",""
"https://global-uploads.webflow.com/63994dae1033718bee6949ce/63ebff1cd51df48649894ef7_tability-better-goals_1_lbv3je.jpeg","Tability","A tool for goal setting and tracking with OKRs.","Productivity","14",""
"https://global-uploads.webflow.com/63994dae1033718bee6949ce/63ebff1b4eba8e3c727e0d62_social-card.png","ChatWP","A custom chatbot from your own data and integration with websites, apps, and more.","Chat","18",""
"https://global-uploads.webflow.com/63994dae1033718bee6949ce/63ebff1afafcd5dfcf047332_meta-hero.png","Beam","A tool for developers to deploy AI projects and models in a serverless environment.","Productivity","10",""
"https://global-uploads.webflow.com/63994dae1033718bee6949ce/63ecc553af923931ba16734f_pianogenie-logo.png","Piano Genie","A tool that lets you play the piano with their keyboard or phone.","For Fun","25",""
"https://global-uploads.webflow.com/63994dae1033718bee6949ce/63ebff186d8e6e2173ac3265_the-gpt-who-lived.png","The GPT Who Lived","A tool is a cloud-based file storage and collaboration platform.","For Fun","12",""
"https://global-uploads.webflow.com/63994dae1033718bee6949ce/63ecc0b2d4a28e27d832a32c_heycli-logo.png","heyCLI","A command line tool that translates natural language into terminal commands.","Productivity","9",""
"https://global-uploads.webflow.com/63994dae1033718bee6949ce/63ebff1674ba015e01533903_meta-preview.png","Dumme","A short video generator and upload with captions, titles, and descriptions.","Generative Video","39",""
"https://global-uploads.webflow.com/63994dae1033718bee6949ce/63eca9f7b64b977bbdbda596_mendable-logo.png","Mendable","A tool to create a chat powered search trained on your documentations.","Marketing","22",""
"https://global-uploads.webflow.com/63994dae1033718bee6949ce/63ebff13b4cc3869d9f85a9c_cover.jpeg","Prompt Hunt","A tool to create, edit and share consistent graphics assets and themes.","Prompt Guides","24",""
"https://global-uploads.webflow.com/63994dae1033718bee6949ce/63ebff121f7fdfdf6be93435_og.png","Fireflies AI","An automated meeting note-taking tool for transcriptions, recaps, tasks, and analytics.","Productivity","12",""
"https://global-uploads.webflow.com/63994dae1033718bee6949ce/63ebff115d7632867aa81895_63ba04a618d4e06dad2beab1_castmagicpreview.png","Castmagic","An automated post-production tool to streamline podcast creation.","Podcasting","21",""
"https://global-uploads.webflow.com/63994dae1033718bee6949ce/63ebff105d763254d5a8182a_63b0063b30817d3391de9974_dp.png","User Evaluation","A tool that provides insights from customer conversations.","Marketing","7",""
"https://global-uploads.webflow.com/63994dae1033718bee6949ce/63ebff0f74905038835440a2_thumbnail.png","OneLiner (For Figma)","A Figma plugin for copywriting.","Copywriting","15",""
"https://global-uploads.webflow.com/63994dae1033718bee6949ce/63eca3149499841584c2c828_wowto-logo.png","WowTo","An all-in-one video creation and knowledge base platform to create, host, and update videos.","Marketing","9",""
"https://global-uploads.webflow.com/63994dae1033718bee6949ce/63eca17a0f3a11d12cac5097_hotbot-logo.png","HotBot","A Google Chrome Extension for web searching with VPN support.","Productivity","13",""
"https://global-uploads.webflow.com/63994dae1033718bee6949ce/63eca0551f7bad55291971c2_superchat-logo.png","SuperChat","A content creation tool to generate text optimized for SEO.","Copywriting","14",""
"https://global-uploads.webflow.com/63994dae1033718bee6949ce/63ec9b69af14b7b493a3da81_midjourney-prompt-generator-logo.png","Midjourney Prompt Generator","A midjourney prompt generator.","Generative Art","206","Prompt Guides"
"https://global-uploads.webflow.com/63994dae1033718bee6949ce/63ea9c1e1b7cedafffbd284c_WPCHAT-LOGO.png","WP AI Chat","A chat widget for your website, train with your own data in minutes.","Chat","12",""
"https://global-uploads.webflow.com/63994dae1033718bee6949ce/63eaae3993f02557e16afa2c_poster-img-fb.png","Muse AI","An all-in-one video hosting provides 4K playback, analytics, and AI search.","Video Editing","30",""
"https://global-uploads.webflow.com/63994dae1033718bee6949ce/63ea99d565e07d352db82442_og.png","Auto Backend","A tool to create backend platform and more.","Productivity","19",""
"https://global-uploads.webflow.com/63994dae1033718bee6949ce/63ea99d4fe0adc24c82203de_6jO6IXh8fS8LJztR4AWL4cho161oFrdM34zFbc3hX_BOHKTvbJnlaBU3ArLxp41hMh4uUM6_ut_-DkDvIGhSkjqfPw%3Dw128-h128-e365-rj-sc0x00ffffff.jpeg","ArxivGPT","A Chrome Extension to summarize a arXiv paper and get insights.","Productivity","18",""
"https://global-uploads.webflow.com/63994dae1033718bee6949ce/63eb456c2a15ac3453631cc8_cognify-studio-logo.png","Cognify Studio","A design app to transform photos to designs.","Image Improvement","20",""
"https://global-uploads.webflow.com/63994dae1033718bee6949ce/63ea99d3ffe0de4a884463e5_63db9b98cd4604c4e55da497_sharing-picture.png","HirePeople","A Google Chrome Extension for sending bulk personalized LinkedIn invitations.","Marketing","15",""
"https://global-uploads.webflow.com/63994dae1033718bee6949ce/63ea99d257f45aa0b2b00db2_thumbnail.png","Contentinator","A Figma plugin to generate content, images, and copywriting.","Copywriting","10",""
"https://global-uploads.webflow.com/63994dae1033718bee6949ce/63ea99d170ed91ba7ec10c42_268783_412a7e33362945ccb9bb4a88003eb6aa~mv2.png","Versy AI","A platform to create virtual experiences from text prompts.","Generative Video","47",""
"https://global-uploads.webflow.com/63994dae1033718bee6949ce/63ea99d0f42f4b58cd59ee4f_photo-ai-social-media-pic-2023-01-13.jpeg","Photo AI","A tool for Photographers to create custom photo shoots, training own models, copycatting photos.","Image Improvement","92",""
"https://global-uploads.webflow.com/63994dae1033718bee6949ce/63eb39e1a7e20753afd520e7_essaygrader-logo.png","EssayGrader","A tool for teachers to grade essays summarization, spelling and grammar check and feedback.","Productivity","5",""
"https://global-uploads.webflow.com/63994dae1033718bee6949ce/63ea99cf30ad839ce040bdc9_preview.png","DenoLyrics","A tool to transcribe audio into text in over 50 languages.","Speech-To-Text","34",""
"https://global-uploads.webflow.com/63994dae1033718bee6949ce/63eb37cc1812ab9e0e1fbf3c_imagegenerator-ai-logo.png","Image Generator AI","A mobile app to generate unique variations of any given image.","Generative Art","42",""
"https://global-uploads.webflow.com/63994dae1033718bee6949ce/63ea99cd79fa9b098b12d465_cover_option1_3.png","Sellesta AI","a suite of tools to optimize Amazon listings.","Marketing","11",""
"https://global-uploads.webflow.com/63994dae1033718bee6949ce/63eb33fce8ad1b7ce84c96e4_booltool-logo.png","Booltool","An all-in-one suite of tools for content creation, image tools and video tools.","Productivity","17","Copywriting"
"https://global-uploads.webflow.com/63994dae1033718bee6949ce/63eb31d21b9109dc428c1103_promptbase-logo.png","PrompBase","A tool for customized midjourney prompt generator.","Prompt Guides","13",""
"https://global-uploads.webflow.com/63994dae1033718bee6949ce/63ea99c889d00c3e67e5d8fb_629ce6594bf2b51e8db3aff6_platform%2520demo.jpeg","BHuman","A tool that creates personalized videos at scale.","Marketing","17",""
"https://global-uploads.webflow.com/63994dae1033718bee6949ce/63eb2e8e765bacc6e682f531_vizologi-logo.png","Vizologi","A chatbot for business strategy, create and edit business plans, conduct market research, and analyze competitors.","Chat","12",""
"https://global-uploads.webflow.com/63994dae1033718bee6949ce/63eb0cb239881e2746ec9772_finevoice-logo.webp","FineVoice","A digital voice solution to enhance and customize voices in real-time.","Voice Modulation","37",""
"https://global-uploads.webflow.com/63994dae1033718bee6949ce/63ea64bb294696809237d586_sivi-logo.png","Sivi","A tool to turn your text into full visual designs.","Generative Art","25",""
"https://global-uploads.webflow.com/63994dae1033718bee6949ce/63ea6268d64d0e7e5dc6a8dc_evolup-logo.png","Evolup","An all-in-one solution to create and manage amazon affiliate stores.","Marketing","16",""
"https://global-uploads.webflow.com/63994dae1033718bee6949ce/63ea60098a03f35c7e44f131_getproduct-help-logo.png","ProductBot","A tool to help you decide what to buy on Amazon and get recommendations based on your preferences.","Aggregators","18",""
"https://global-uploads.webflow.com/63994dae1033718bee6949ce/63ea5d5bad9e2d33414c7a3f_askrobi-logo.png","Ask Robi","A Whatsapp companion contact for writing, translating, math, code, and spreadsheets.","Chat","24",""
"https://global-uploads.webflow.com/63994dae1033718bee6949ce/63ea24cffef9625ba94b871e_coverler-logo.png","Coverler","A tool to create a unique cover letter from your details and job description.","Productivity","11",""
"https://global-uploads.webflow.com/63994dae1033718bee6949ce/63ea1057b88c09f6c0a1bf25_synthesys-studio-logo.png","Synthesys Studio","A tool to create ai videos, text to speech ai voice over, and text to video with ai avatars.","Text-To-Speech","91","Text-To-Video"
"https://global-uploads.webflow.com/63994dae1033718bee6949ce/63e8bdb92bc2aafe8cd58fb6_roshi-logo.png","Roshi","A tool that enables teachers to create engaging learning material from any online source.","Productivity","14",""
"https://global-uploads.webflow.com/63994dae1033718bee6949ce/63e9f08afd650ee1e2d1001d_voila-logo.png","Voila","A Google Chrome Extension to automatically creating copy, summarizing and translating text, responding to emails.","Chat","12",""
"https://global-uploads.webflow.com/63994dae1033718bee6949ce/63e9eec863a382084d38ce5f_web3summary-logo.png","Web3 Summary","A Google Chrome Extension to simplify complex crypto projects into easy-to-understand explanations.","Finance","34",""
"https://global-uploads.webflow.com/63994dae1033718bee6949ce/63e9deb8f93ed99d5764703e_textcortext-logo.png","TextCortex AI","A content writing suite with content generation, paraphrasing, summarizing, and more.","Copywriting","119",""
"https://global-uploads.webflow.com/63994dae1033718bee6949ce/63e9da49f93ed97625605b49_beatoven-logo.png","Beatoven.ai","A tool for royalty free custom mood-based soundtracks music composition for videos and podcasts.","Music","26",""
"https://global-uploads.webflow.com/63994dae1033718bee6949ce/63e9e2cffa5f3db2faf79908_cleanvoice-logo.png","Cleanvoice AI","A tool for audio editing, remove filler sounds, stuttering, mouth sounds, and other artifacts from audio recordings.","Podcasting","21",""
"https://global-uploads.webflow.com/63994dae1033718bee6949ce/63e9d807f93ed948035e8651_illustroke-logo.png","Illustroke","A tool to create vector illustrations from text prompts.","Generative Art","77","Matt's Picks"
"https://global-uploads.webflow.com/63994dae1033718bee6949ce/63e949ed77258c933ae38fcd_Logo-whote-background.png","CopyMonkey","A tool for amazon listing optimization tool, amazon listing content generation and competitor insights.","Marketing","6",""
"https://global-uploads.webflow.com/63994dae1033718bee6949ce/63e9cc8ff93309c21b08c2d3_imaiger-logo.png","Imaiger","An AI Image Search tool to find images for various purposes.","Aggregators","23",""
"https://global-uploads.webflow.com/63994dae1033718bee6949ce/63e9cbe277dff80c5c42a6a1_picfinder-logo.png","PicFinder.AI","A tool to generate infinite number of prompt based images and size customization.","Generative Art","140",""
"https://global-uploads.webflow.com/63994dae1033718bee6949ce/63e9c9bcbbd47ffedf108a88_markopolo-logo.png","Markopolo","An eCommerce growth platform to optimize ads and personalize omnichannel marketing.","Marketing","71",""
"https://global-uploads.webflow.com/63994dae1033718bee6949ce/63e949eed1100c02aeb8c117_th.jpeg","Bing","Bing Chatbot With ChatGPT","Chat","220","Matt's Picks"
"https://global-uploads.webflow.com/63994dae1033718bee6949ce/63e8ac9ffa5f3d3e76eba0fe_codenull-logo.png","Codenull.ai","A platform to build AI models without coding.","Marketing","45","Finance"
"https://global-uploads.webflow.com/63994dae1033718bee6949ce/63e8b09e882046bac45f939e_Genius-logo.png","Genius","A tools suite for UI-AI, Figma Automation, a magical design tool.","Productivity","14",""
"https://global-uploads.webflow.com/63994dae1033718bee6949ce/63e5e04208a755b53858f992_soundbite_logo_purple.png","Soundbite","A tool that turns audio and video content into blogs, social media posts, and summaries in seconds.","Marketing","24",""
"https://global-uploads.webflow.com/63994dae1033718bee6949ce/63e8ab38a19e87770e32406c_usegalileo-logo.png","Galileo AI","A design tool to create editable UI designs from text descriptions and images.","Marketing","55",""
"https://global-uploads.webflow.com/63994dae1033718bee6949ce/63e8a7e6a4e084fe162d0252_STRING-logo.png","STRING","The data analysis platform for data visualizations and data insights.","Chat","11",""
"https://global-uploads.webflow.com/63994dae1033718bee6949ce/63e8a53f20ffc4be5964c046_customGPT-logo.png","CustomGPT","A tool to create your own customized AI-powered chatbots.","Chat","12",""
"https://global-uploads.webflow.com/63994dae1033718bee6949ce/63e89b3eb70a2f0849f76bbc_decoherence-logo.png","Decoherence","A tool to Create AI animations and synchronize them with your music.","Generative Video","72","Matt's Picks"
"https://global-uploads.webflow.com/63994dae1033718bee6949ce/63e83f5325e31b210eb4c4f4_ai-rpg-avatar.jpeg","LitRPG Adventures","A tool that provides RPG content and generators for a variety of tabletop role-playing games.","Gaming","29",""
"https://global-uploads.webflow.com/63994dae1033718bee6949ce/63e880d7477d25e8c03363c6_kwirk-logo.png","Kwirk","An office application for document management, summarization, feedback, and translation services.","Productivity","23",""
"https://global-uploads.webflow.com/63994dae1033718bee6949ce/63e87f68e44734d06675c379_postly-logo.png","Postly","A tool to design and publish social media marketing campaigns at scale.","Marketing","19",""
"https://global-uploads.webflow.com/63994dae1033718bee6949ce/63e8733a914e3c2b37dd5221_aissistify-logo.webp","AIssistify","A HubSpot automation tool to enhance marketing, sales, and RevOps processes.","Chat","8",""
"https://global-uploads.webflow.com/63994dae1033718bee6949ce/63e87995bc3448642b76a963_avatarize-club-logo.png","Proface by Avatarize","A tool offering professional headshots and profile pictures.","Avatar","11",""
"https://global-uploads.webflow.com/63994dae1033718bee6949ce/63e87db3fbbd06a77b9de504_chaingpt-logo.png","ChainGPT","A blockchain-based AI model designed to help with crypto and blockchain tasks.","Finance","45",""
"https://global-uploads.webflow.com/63994dae1033718bee6949ce/63e83f5bc5db5606d31a3237_Preview-image.png","Kaedim","A tool that enables users to generate 3D models from 2D images.","Gaming","41","Generative Art"
"https://global-uploads.webflow.com/63994dae1033718bee6949ce/63e83f5cf93ed9581d0432e9_vlcsnap-2023-02-04-16h15m10s908.png","Peachly AI","AI solution for creating, targeting and optimizing Facebook, Instagram and Google ads","Marketing","26",""
"https://global-uploads.webflow.com/63994dae1033718bee6949ce/63e70864b6df3b0c23eb99a7_Screenshot-2-10-2023-7.15.38%20PM.png","Chatmate AI","Artificial people to be friends with","Chat","31",""
"https://global-uploads.webflow.com/63994dae1033718bee6949ce/63e5e0446b13b4d213ac778a_620b02c0c292cf333e9c9628_Promotion%2520image.png","Laxis","Real-time transcription audio to text","Speech-To-Text","57",""
"https://global-uploads.webflow.com/63994dae1033718bee6949ce/63e5e03f0c61ba59bd77b1aa_magic_cover.jpeg","Piggy Magic","Create an engaging and shareable webpage in seconds","Generative Code","116",""
"https://global-uploads.webflow.com/63994dae1033718bee6949ce/63e706db60afc2533e8762d6_Screenshot-2-10-2023-7.09.05%20PM.png","CleoAI","Assists with Brainstorming, Ideation, Writing, Coaching, and Web Search","Chat","29",""
"https://global-uploads.webflow.com/63994dae1033718bee6949ce/63e7077a1eb4adcc83c92b71_YGBNUMrK_400x400.jpg","Steamship","Host managed LangChain Apps in seconds","Generative Code","7",""
"https://global-uploads.webflow.com/63994dae1033718bee6949ce/63e705d3cde80f79c64e3ce5_Screenshot-2-10-2023-7.04.39%20PM.png","Artflow","Tool for creating animated stories with original characters, scenes, dialogue, and assets","Generative Video","72","Text-To-Speech"
"https://global-uploads.webflow.com/63994dae1033718bee6949ce/63e705618cfec2e925573cd2_Screenshot-2-10-2023-7.02.50%20PM.png","codesnippets","Enables developers to create, share, and debug secure code snippets","Generative Code","152",""
"https://global-uploads.webflow.com/63994dae1033718bee6949ce/63e6f1ac79f9de36ec39ca28_Pix2Pix-Video.png","Pix2Pix Video","Let's you change a video with text prompts","Generative Video","153","Matt's Picks"
"https://global-uploads.webflow.com/63994dae1033718bee6949ce/63e6c0ff15508843e09349e9_booom-logo.4dbb4100.png","Booom.ai","AI trivia game generator","For Fun","56","Matt's Picks"
"https://global-uploads.webflow.com/63994dae1033718bee6949ce/63e5e0456a78a37ff4a39f5f_Microsoft.VisualStudio.Services.Icons.png","Code-GPT","Instant code explanations to help users understand and code faster","Generative Code","75",""
"https://global-uploads.webflow.com/63994dae1033718bee6949ce/63e5e30f3dcb4c62e3824f04_Screenshot-2-9-2023-10.24.00%20PM.png","Textbuddy","Analyzes and improves your spelling, grammar, and readability","Copywriting","48",""
"https://global-uploads.webflow.com/63994dae1033718bee6949ce/63e5e03d2c339882be1ea9bf_share-img-aiisajoke.png","AI Is a Joke","Enter a topic and it will give you a joke","For Fun","81",""
"https://global-uploads.webflow.com/63994dae1033718bee6949ce/63e70a0f68bea524cbf30df6_iI7JVBMl_400x400.jpg","Percy Lab","Percy Lab can generate very complete texts on demand with the Open AI api.","Research","28",""
"https://global-uploads.webflow.com/63994dae1033718bee6949ce/63e16a191f951091e99f518b_og-main.jpeg","iconifyai.com","Icon generator that creates icons for apps and websites","Generative Art","46",""
