"tool_mage_url","tool","tool_description","category","upvotes","tags"
"https://global-uploads.webflow.com/63994dae1033718bee6949ce/63c85ecadd267e0362f9e789_63221483ce28195d27ad8505_628295b817892a2a28f58ff9_Frame%202%20(2)-min.png","Listnr","High-quality text-to-speech generator","Text-To-Speech","85","Matt's Picks"
"https://global-uploads.webflow.com/63994dae1033718bee6949ce/63c85e888b0dd6d9a8d015f6_60a0567fa9e15b552697dc33_Speecheasy-app-badge%20(1).png","SpeechEasy","High-quality text-to-speech generator","Text-To-Speech","53",""
"https://global-uploads.webflow.com/63994dae1033718bee6949ce/63c85d16763719398adc7010_1ed7cd5f-8842-4e3e-ba97-a5f0138c9c7e.png","Komo Search","Generative AI to Put Your Search Journeys First","Chat","126",""
"https://global-uploads.webflow.com/63994dae1033718bee6949ce/63c85d1aa9800315766c1f91_crOM1mq.jpeg","Konjer","A library full of talking books","Chat","81","Research"
"https://global-uploads.webflow.com/63994dae1033718bee6949ce/63c832c9e0bbc25fc73fd12a_logo-head.png","Legalese Decoder","Translate Legal docs to plain English","Research","64",""
"https://global-uploads.webflow.com/63994dae1033718bee6949ce/63c832c82f26af5f16510c91_auri-ai-assistant-iphone-app.jpeg","Auri.AI","AI Writing Assistant to Help You Write Faster and Smarter","Translation","55","Copywriting"
"https://global-uploads.webflow.com/63994dae1033718bee6949ce/63c832c96f351a6ac79ef906_meta-general.1b0472a58d18.png","Kickresume","Create a resume quickly with the help of artificial intelligence","Self-Improvement","45",""
"https://global-uploads.webflow.com/63994dae1033718bee6949ce/63c71498c65a59375af90751_622af07ac901834308f6b2db_website%2520image.png","Mem","AI-powered workspace that's personalized to you (Think Evernote with AI)","Productivity","51","Matt's Picks"
"https://global-uploads.webflow.com/63994dae1033718bee6949ce/63c714636cb953301f5bc2e2_Make-Waves-Facebook-Banner_2_WithoutText-1.png","Soundful","AI Music Generator","Music","142",""
"https://global-uploads.webflow.com/63994dae1033718bee6949ce/63c71500fc9435ff38f13be6_Screenshot-1-17-2023-1.19.06%20PM.png","Character GPT","Generates interactive AI Characters from a description","Chat","194","Generative Video"
"https://global-uploads.webflow.com/63994dae1033718bee6949ce/63c7146559dc924b067419a0_cover-quizgrowth-39e8c0a579c1568c5f2dd58b5ef2be1537bc87ee990161c99883a7514f042c2f.png","QuizGrowth","Turn your content into engaging quizzes","Marketing","18",""
"https://global-uploads.webflow.com/63994dae1033718bee6949ce/63c71464aaacb69078a795c8_WaverlySplash.png","Waverly","AI that helps you focus on the content you need","Productivity","21","Research"
"https://global-uploads.webflow.com/63994dae1033718bee6949ce/63c714675ed1990482d147d0_img-book.png","InstaNovel","Generate your own mini-novel with 1 prompt","For Fun","66",""
"https://global-uploads.webflow.com/63994dae1033718bee6949ce/63c714956f3a6d6c1feb4395_955484c8-8453-4fc8-9a05-3514e4310065.png","Bito","A suite of coding tools for developers","Generative Code","37",""
"https://global-uploads.webflow.com/63994dae1033718bee6949ce/63c7152bcdf60a5cd68ee8a8_Screenshot-1-17-2023-1.04.24%20PM.png","Phosus","AI-powered Image Enhancement Tools","Image Improvement","23",""
"https://global-uploads.webflow.com/63994dae1033718bee6949ce/63c7146b2543617853f08877_iaHPuRKNLyYrity5PqJ6yh2iOm2A9jzbdMiWmPNXRVv4fhYDhYXuNzsP5gry-sOHtsp3k15YCwPHZmHuCojVncIx4g%3Dw128-h128-e365-rj-sc0x00ffffff.jpeg","Ghostwrite","ChatGPT Email Assistant","Copywriting","59","Productivity"
"https://global-uploads.webflow.com/63994dae1033718bee6949ce/63c714975ed199be7ad176ca_banner.png","MightyGPT","ChatGPT on Whatsapp","Chat","47",""
"https://global-uploads.webflow.com/63994dae1033718bee6949ce/63c7146833775c392d23fbd7_og-image.png","Twitter Bio Generator","Generate your next Twitter bio in seconds","Social Media","54",""
"https://global-uploads.webflow.com/63994dae1033718bee6949ce/63c714605ed1993f09d14364_05e2095b-79e3-46d4-83e9-3ff7a87abc99.png","Mark Copy AI","Create, schedule, publish, and easily manage your content creation at scale","Copywriting","16",""
"https://global-uploads.webflow.com/63994dae1033718bee6949ce/63c714ccaea1990142b19ab4_Screenshot-1-17-2023-1.07.22%20PM.png","GhostWryter","AI Writer, Content Ideas Generator and Writing Assistant","Copywriting","21",""
"https://global-uploads.webflow.com/63994dae1033718bee6949ce/63c71499a3f98709cbd12b63_RLZ2iKIIgpimbF0CUqTN5X5jkg.png","Promptstacks","Free vetted prompts curated for tools like ChatGPT","Prompt Guides","77","Matt's Picks"
"https://global-uploads.webflow.com/63994dae1033718bee6949ce/63c7146b2543615533f0887b_cover.a8227bb9.jpeg","Is This Image NSFW?","Analyzes if an image is safe for work or not","AI Detection","22",""
"https://global-uploads.webflow.com/63994dae1033718bee6949ce/63c7145f6cdfcd7cd951ba72_intro.png","Localio AI","Ai writing assistant tailored for businesses, consultants & agencies","Copywriting","13",""
"https://global-uploads.webflow.com/63994dae1033718bee6949ce/63c5b97b5f3ff191da777a57_New%20slide%20%2301-1.png","GPT For Sheets","Integrate GPT-3 directly into Google Sheets","Productivity","128","Generative Code"
"https://global-uploads.webflow.com/63994dae1033718bee6949ce/63c5952764c2a0c6e21d97bc_logo2.png","Magic Thumbnails","Generate custom YouTube thumbnails","Generative Art","34","Marketing"
"https://global-uploads.webflow.com/63994dae1033718bee6949ce/63c5b8be17070439c3da2cca_Screenshot%20(187).png","Paper Brain","Makes complex papers easy to understand","Research","86","Matt's Picks"
"https://global-uploads.webflow.com/63994dae1033718bee6949ce/63c59521dd9a320fa5b2fb29_https%253A%252F%252Fs3.amazonaws.com%252Fappforest_uf%252Ff1673609379908x706951975014431100%252FUntitled%252520design%252520-%2525202023-01-13T112907.775.png","Getaiway","Create personalized, budget-friendly travel plans","For Fun","28",""
"https://global-uploads.webflow.com/63994dae1033718bee6949ce/63c5951f838ff553356e5b4e_https%253A%252F%252Fs3.amazonaws.com%252Fappforest_uf%252Ff1673725405125x221462716032177820%252F63c21750b37c781309e48674-transparent.png","Photor","Image recognition to analyze and select the best images for professional or personal use","Social Media","57",""
"https://global-uploads.webflow.com/63994dae1033718bee6949ce/63c5b44b88e0b383ec3a6177_photo-1517694712202-14dd9538aa97.jpg","Keywrds.ai","Deep dive into any niche and uncover keywords that your target audience is searching for","Marketing","60",""
"https://global-uploads.webflow.com/63994dae1033718bee6949ce/63c5951d34bed233eb38cd6d_da-fb.jpeg","Designs.ai","Create logos, videos, banners, mockups with A.I. in 2 minutes","Generative Art","88","Marketing"
"https://global-uploads.webflow.com/63994dae1033718bee6949ce/63c59524c4172e64d1472b26_Card-Dark-2.png","Jaq n Jil","AI-powered writing assistant to quickly create content","Copywriting","58","Matt's Picks"
"https://global-uploads.webflow.com/63994dae1033718bee6949ce/63c5a5dd170704ca64d8acb1_Screenshot%20(185).png","Rephrasee","Simplify or rephrase any text input","Copywriting","128",""
"https://global-uploads.webflow.com/63994dae1033718bee6949ce/63c59524287bcba8c2d947b2_b1196f68-da22-460e-ac17-774e14ae6c27.png","Ordinary Prompts","Create ChatGPT prompts for everyone","Prompt Guides","447",""
"https://global-uploads.webflow.com/63994dae1033718bee6949ce/63c59e700eda4961e86b6c0e_dog_hero_homepage.jpg","ARTSMART AI","AI-powered image tool for creative fun and business purposes","Generative Art","37",""
"https://global-uploads.webflow.com/63994dae1033718bee6949ce/63c4966f7ceee985fff58218_inklogo2022.png","INK","AI Content creation tool that generates unique, SEO-optimized content","Copywriting","16",""
"https://global-uploads.webflow.com/63994dae1033718bee6949ce/63c496700db0886e730ec2c5_midjourney%252Fimages%252F341434f9-cef9-4596-86d6-9833653385ae.png","MidJourney Prompt Tool","Helps users generate creative prompts by giving them ideas, suggestions, and an inspiration image.","Prompt Guides","417","Matt's Picks"
"https://global-uploads.webflow.com/63994dae1033718bee6949ce/63c466c6b661e5538af63997_cdb0312a-abb3-4880-a549-af4c6223e3b3_Supermeme_Twitter_Card_876_438_px_png.png","Supermeme.ai","An AI-powered meme generator","For Fun","48","Marketing"
"https://global-uploads.webflow.com/63994dae1033718bee6949ce/63c466c858ebaedf59932469_LcSocial.png","DoNotPay","Get legal help using AI","Finance","88","Self-Improvement"
"https://global-uploads.webflow.com/63994dae1033718bee6949ce/63c48d824553f622c4da499d_a7c95ddf-2a44-4b32-a9f8-7965a4c29c05.png","Applicant AI","Uses AI to quickly create resumes and cover letters from a LinkedIn profile","Self-Improvement","97","Social Media"
"https://global-uploads.webflow.com/63994dae1033718bee6949ce/63c466c7d8a8a707e371bcb7_AtOnce.png","AtOnce","Content generator and CRM","Copywriting","15","Social Media"
"https://global-uploads.webflow.com/63994dae1033718bee6949ce/63c466ca34044028a0f6cb14_1200x630wa.png","Scribble AI","Text generator that quickly creates content in any style, for any topic","Copywriting","99",""
"https://global-uploads.webflow.com/63994dae1033718bee6949ce/63c466c4375e002aa3709b03_tldrthis-krishna.jpeg","TLDR This","Automated summarization, metadata extraction, paraphrasing, and clickbait filtering","Research","24","Productivity"
"https://global-uploads.webflow.com/63994dae1033718bee6949ce/63c466c2ab4d656ab3e44fb5_cartoonizer-cover.jpeg","Pandora Avatars","Avatar generation app to make fun images with your own face","Avatar","44","Generative Art"
"https://global-uploads.webflow.com/63994dae1033718bee6949ce/63c466c3340440646df6c472_leiapix_logo_and_background.b1085ff2.png","LeiaPix","Upload an image and turn it into a 3D animation","Image Improvement","4893","Generative Video"
"https://global-uploads.webflow.com/63994dae1033718bee6949ce/63c6024ab8a2d201590b0df6_UW2JmKXW.jpg","Stylized","Quickly creates professional product images from phone photos","Generative Art","24","Marketing"
"https://global-uploads.webflow.com/63994dae1033718bee6949ce/63c466c1f47f2705bfcded90_icon_512x512.a28461.png","VanceAI Image Upscaler","Enlarge images up to 800% with improved resolution in just a few seconds","Image Improvement","36",""
"https://global-uploads.webflow.com/63994dae1033718bee6949ce/63c47eeb94eb397e3a03ca96_Screenshot%20(182).png","MetaGenieAI","Automatically generates titles, descriptions, tags, and thumbnail ideas","Marketing","16",""
"https://global-uploads.webflow.com/63994dae1033718bee6949ce/63c31b852405e72353d27e34_t0QxIp45_400x400.jpg","BlueWillow","AI-powered image generating tool in Discord","Generative Art","1933","Matt's Picks"
"https://global-uploads.webflow.com/63994dae1033718bee6949ce/63c2edc72f391a24d9687581_tweet-to-video.png","Tweet to Video","Turn your Tweet into a video to share as TikTok, Instagram Reel, Youtube Short and more.","Social Media","41","Generative Video"
"https://global-uploads.webflow.com/63994dae1033718bee6949ce/63c2edc135d2ad1ea7cb4e76_og.jpeg","Gimme Summary AI","Chrome extension that uses ChatGPT AI to summarize articles on the web","Research","60","Productivity"
"https://global-uploads.webflow.com/63994dae1033718bee6949ce/63c2edc63f2dea498d9f6713_63be93b30c56293afff64433_OpenGraph.png","MagicBlog","Quickly generate high-quality, SEO-optimized, original blog content with just one click","Copywriting","21","Marketing"
"https://global-uploads.webflow.com/63994dae1033718bee6949ce/63c2edca6dceee84f5c89741_prompt-builder-v0-2-0.webp","promptoMANIA","AI art community with an online prompt builder for generative art","Prompt Guides","69","Matt's Picks"
"https://global-uploads.webflow.com/63994dae1033718bee6949ce/63c2edc93941fc53f57e9604_mian-banner-bg-2.jpeg","AI Photos","Create unique personalized avatars with customizable images and styles","Generative Art","135","Avatar"
"https://global-uploads.webflow.com/63994dae1033718bee6949ce/63c2edc86c0adc54eb8ffe67_https%253A%252F%252Fs3.amazonaws.com%252Fappforest_uf%252Ff1672792673747x420401029024378240%252Fzixxy.png","AI Office Bot","AI-powered office assistant that provides instant answers to software questions","Productivity","24","Generative Code"
"https://global-uploads.webflow.com/63994dae1033718bee6949ce/63c2edc521eff5f049658fb8_63bcd720be351f03c95bf25f_open-graph.png","Booth.AI","Quickly generate high-quality product images with just a few steps","Marketing","27","Generative Art"
"https://global-uploads.webflow.com/63994dae1033718bee6949ce/63c19de85ee05b7bb4ca3771_social_logo-1.png","Contents.com","Helps with both ideation and the creation of content","Copywriting","15","Marketing"
"https://global-uploads.webflow.com/63994dae1033718bee6949ce/63c1ad13d9895e5374ad2351_Tkgaw9L1_400x400.jpg","Eleven Labs","Create natural sounding voices for creators and publishers","Text-To-Speech","1140","Matt's Picks"
"https://global-uploads.webflow.com/63994dae1033718bee6949ce/63c1ae78aea5609d09995042_Screenshot%20(175).png","Manna","AI autocomplete across your MacOS apps","Chat","17","Productivity"
"https://global-uploads.webflow.com/63994dae1033718bee6949ce/63c05d37b2ae82d93225c7f5_og-image.png","Campbell","Uses AI to help quickly write employee performance reviews","Copywriting","23","Productivity"
"https://global-uploads.webflow.com/63994dae1033718bee6949ce/63c1ab62dee61430b7fd1030_it2Lxn3l_400x400.jpg","Godly","Combine GPT-3 with your own added information to get personalize results","Chat","41",""
"https://global-uploads.webflow.com/63994dae1033718bee6949ce/63c05d35a5eff79550dee088_metavoice-card.png","MetaVoice Studio","Record your voice and this tool will convert it to other voices","Voice Modulation","148",""
"https://global-uploads.webflow.com/63994dae1033718bee6949ce/63c05d3672ddac42a1c62370_landing-page.png","Vivid","Edit code for your app directly inside your browser","Generative Code","8",""
"https://global-uploads.webflow.com/63994dae1033718bee6949ce/63c05d35ba2c5d9e750a43e6_cK16UDrKcAtUQG9cTknlEn59DIE.jpeg","Mason","AI-powered data analytics for teams building software","Productivity","27","Research"
"https://global-uploads.webflow.com/63994dae1033718bee6949ce/63c05d33aefbac4164842c9a_colourful-cubist-parrot.jpeg","NightCafe Creator","AI Art Generator with a community features and printing service","Generative Art","36","Matt's Picks"
"https://global-uploads.webflow.com/63994dae1033718bee6949ce/63c04528a98889a78db6bd84_63a4540316e186564a1149d0_AI-OpenGraph.png","bardeen","Use AI to automate a lot of manual workflows","Generative Code","30","Productivity"
"https://global-uploads.webflow.com/63994dae1033718bee6949ce/63c0452ba95ec17719c1f7ea_ai-surveys.jpeg","BlockSurvey","Survey tool that uses AI to generate questions","Marketing","17","Research"
"https://global-uploads.webflow.com/63994dae1033718bee6949ce/63c04a6be09cb576ef65b8d9_Screenshot%20(172).png","ResumAI","Use AI to quickly build a resume","Self-Improvement","26",""
"https://global-uploads.webflow.com/63994dae1033718bee6949ce/63c048a861893b3376a577d9_Screenshot%20(171).png","CheckforAi","Detect AI written text in essays, emails, and more","AI Detection","65",""
"https://global-uploads.webflow.com/63994dae1033718bee6949ce/63c045275c5389ba2ba59e7e_VF_Open_Graph.png","Voiceflow","Create interactive Chatbots with drag-and-drop design","Chat","10","Generative Code"
"https://global-uploads.webflow.com/63994dae1033718bee6949ce/63c0452cc03d2fda3a2fac4c_og.png","Sudowrite","An AI tool to help overcome writer's block when telling stories","Copywriting","35","Inspiration"
"https://global-uploads.webflow.com/63994dae1033718bee6949ce/63bf26698dfe7e588f301363_512x512bb.jpg","PlaylistAI","AI-powered playlist creator for Spotify and Apple Music","Music","79","Inspiration"
"https://global-uploads.webflow.com/63994dae1033718bee6949ce/63bf00ccfc68f51e3b95ba88_metaimg.png","Langotalk","Learn a new language 6x faster through conversations with AI","Self-Improvement","126","Translation"
"https://global-uploads.webflow.com/63994dae1033718bee6949ce/63bf00cb0a50c359252eb7cf_checklistgg-home-meta.png","checklist.gg","AI-powered checklists, processes, and SOPs","Productivity","15",""
"https://global-uploads.webflow.com/63994dae1033718bee6949ce/63bf2365eac5d52eb3cd153d_Screenshot%20(168).png","Fingerprint for Success","An AI-powered life coach","Self-Improvement","37",""
"https://global-uploads.webflow.com/63994dae1033718bee6949ce/63bf215725edd2f019a1d4a9_Screenshot%20(167).png","GiftasticAI","Personalized gift recommendation engine","For Fun","18","Inspiration"
"https://global-uploads.webflow.com/63994dae1033718bee6949ce/63bf1f7e8646dbef2bea394b_2phones.webp","Text GPT","Access OpenAI's GPT and Dall-E 2 through text messages","Chat","47","Generative Art"
"https://global-uploads.webflow.com/63994dae1033718bee6949ce/63bf1e0079ef0d19885e7aff_cropped-logo-transparent480px.png","Free AI Detector","AI Content Detector","AI Detection","49",""
"https://global-uploads.webflow.com/63994dae1033718bee6949ce/63be5084ce38b86d0c70e955_63614d5a27f99c5cf7a665c0_share_thumb.png","SEO.ai","AI powered SEO content platform","Copywriting","32","Marketing"
"https://global-uploads.webflow.com/63994dae1033718bee6949ce/63bf1b4f7e9f2737b3451dc6_63b4bca28991fa502dd3f66d_imageedit_2_9503328400.png","Trudo","Train, test, and deploy your own OpenAI model","Chat","18",""
"https://global-uploads.webflow.com/63994dae1033718bee6949ce/63bf06b782f5b28a6473f4ff_Screenshot%20(166).png","AssemblyAI","Transcribe and understand audio with a single AI-powered API","Speech-To-Text","15","Generative Code"
"https://global-uploads.webflow.com/63994dae1033718bee6949ce/63bf049e50f9feed9b5fa6a2_test2.png","DiscuroAI","Rapidly build & test complex AI work-flows","Generative Code","8",""
"https://global-uploads.webflow.com/63994dae1033718bee6949ce/63be508379084904906ad1a6_monkeylearn-block-9352670492ac838791e55c41953dde2f.png","MonkeyLearn","Text analysis platform to unlock insights from customer feedback","Marketing","11","Research"
"https://global-uploads.webflow.com/63994dae1033718bee6949ce/63be50f0bd2de31eaf7d5f56_9e3e4fa6-3ee1-4d72-b054-593781d60840.png","re:tune","A front-end UI for GPT-3 that you can train","Copywriting","11",""
"https://global-uploads.webflow.com/63994dae1033718bee6949ce/63bda573814615893ad1d364_eli5-logo-icon.png","Explain Like I'm Five","Explains like complex topics like your five","Research","112",""
"https://global-uploads.webflow.com/63994dae1033718bee6949ce/63be4bac17f71c956936c166_63bdb02d876352390bda05ad_GohKO0vt_400x400.jpeg","Waymark","Generate videos based on your brand","Generative Video","45","Text-To-Video"
"https://global-uploads.webflow.com/63994dae1033718bee6949ce/63bda57380e0b8c25978c74a_624d339d92ec87329341bf95_Meta%2520image.png","Tweet Hunter","All-in-one Twitter growth tool with AI suggestions","Social Media","36","Matt's Picks"
"https://global-uploads.webflow.com/63994dae1033718bee6949ce/63be4bab482366562e2ce233_63bdb3779556484f719f3a71_Screenshot%2520(147).png","Upstream AI","Use GPT on Chrome tabs","Chat","14",""
"https://global-uploads.webflow.com/63994dae1033718bee6949ce/63bda571a5f6f1f875496d4c_Siri%2BChatGPT.jpeg","ChatGPT for Siri","Activate ChatGPT through Siri using voice commands","Chat","68",""
"https://global-uploads.webflow.com/63994dae1033718bee6949ce/63bda57041bca1506f1e4309_ogimage-73a2cd8057c5527e49dd9417858196677653dc6be55030175999aac9843504bd.png","We Made a Story","Create your own stories using Artificial Intelligence","For Fun","27",""
"https://global-uploads.webflow.com/63994dae1033718bee6949ce/63be4b8cf1dcf708c55fe60d_63bdb77c5b7f240b8f5c243e_PhotoRetouching-1.webp","AILab Tools","Suite of image processing tools","Image Improvement","105",""
"https://global-uploads.webflow.com/63994dae1033718bee6949ce/63bda56effc7bd85338fd692_321bc13e-6c30-4977-8c46-dd57b0a3375d.png","STUDIO","Web Design Using AI","Marketing","54",""
"https://global-uploads.webflow.com/63994dae1033718bee6949ce/63be4ba817f71c806f36c150_63bdb9b62142936a154a3e35_8ebfb4bb-5512-4789-8763-dfb03261980d.png","Synthesys X","Create your own versions of any image you find online","Generative Art","80",""
"https://global-uploads.webflow.com/63994dae1033718bee6949ce/63bda56b2a1941452d8c5e74_6125074c2ace3be392f57afd_1.jpeg","Digital First AI","Find growth-hacking tactics for your business with AI","Marketing","41","Inspiration"
"https://global-uploads.webflow.com/63994dae1033718bee6949ce/63be4ba32cb46308ff677966_63bdbb24ed0a258695ea6347_Screenshot%2520(148).png","Prezo","Prezo is an AI-powered presentation tool","Marketing","24","Generative Art"
"https://global-uploads.webflow.com/63994dae1033718bee6949ce/63be4b94ac4c2ae7ebf157db_63bdbcaca55d326540cff27b_E3WsScTVoAc0llf.png","Dreamily","Create your own AI world and interact with it","For Fun","16",""
"https://global-uploads.webflow.com/63994dae1033718bee6949ce/63bda56abb5d0f5e6beb337d_https%253A%252F%252Fs3.amazonaws.com%252Fappforest_uf%252Ff1666626080250x651066124281168600%252FAI_Social_Bio_social_share.jpeg","AI Social Bio","Creates custom social media bios based on user interests and goals","Social Media","52",""
"https://global-uploads.webflow.com/63994dae1033718bee6949ce/63bda56915917336e384b103_image.jpeg","Bannerbear","API for Automated Image and Video Generation","Generative Art","18","Generative Video"
"https://global-uploads.webflow.com/63994dae1033718bee6949ce/63bc4b6fd59ddf2e9c9a0a27_robot-open-graph.png","AIHelperBot","Build SQL queries instantly with AI","Generative Code","15",""
"https://global-uploads.webflow.com/63994dae1033718bee6949ce/63bc4b6ea5cf1e2e8fa34aff_peopleai.png","PeopleAI","Chat with and learn from historical figures","Chat","46","Research"
"https://global-uploads.webflow.com/63994dae1033718bee6949ce/63be4ba324774f6286669a41_63bc67234444fd4aeb6456e0_Screenshot%2520(144).png","PromptLayer","Maintain a log of your prompts and OpenAI API requests","Generative Code","11",""
"https://global-uploads.webflow.com/63994dae1033718bee6949ce/63bc4b6dcc54dc7de8b2d48b_codeium_logo.png","Codeium","Helps developers understand, modify, and test unfamiliar codebases using natural language","Generative Code","5558",""
"https://global-uploads.webflow.com/63994dae1033718bee6949ce/63bc4b6d60b5ed82d920f28d_og.jpeg","Magician for Figma","AI-powered design tool for Figma","Copywriting","39","Generative Art"
"https://global-uploads.webflow.com/63994dae1033718bee6949ce/63be4b92bd2de3330f7d216c_63bc6946c03161c4f65df26c_contentin-plan2.2c1b9bcf.png","ContentIn","An AI-powered content creation and scheduling tool for LinkedIn","Social Media","17","Copywriting"
"https://global-uploads.webflow.com/63994dae1033718bee6949ce/63be4b955a430553dacd2983_63bc68d55db46c4bfd8513f9_extension.png","ExplainThis.AI","AI assistant that provides users with simplified explanations and summaries of long pages","Research","13",""
"https://global-uploads.webflow.com/63994dae1033718bee6949ce/63be4b9e6e09531d0350673d_63bc6a854eed0f3f42e94d44_6376658f41e09170151213b1_marketing1-p-1080.png","MarketingBlocks AI","AI assistant that helps generate marketing assets in minutes, from copy and design to videos and graphics.","Marketing","244","Copywriting"
"https://global-uploads.webflow.com/63994dae1033718bee6949ce/63bc4b6b6c363943423a8417_share.jpeg","SuenaGringo","Translate text and generate content in different formats and tones (in Spanish)","Copywriting","9","Translation"
"https://global-uploads.webflow.com/63994dae1033718bee6949ce/63bc4b6adf78f4261e074c8d_targum_yellow_banner.png","Targum Video","Quickly transcribe, translate, and share social media videos in any language","Translation","112","Speech-To-Text"
"https://global-uploads.webflow.com/63994dae1033718bee6949ce/63be4bab6e095354f3506842_63bc6da15db46c6a02854c7a_computer.webp","Uminal","Like ChatGPT but can also search the web","Chat","65","Research"
"https://global-uploads.webflow.com/63994dae1033718bee6949ce/63be4badc9d13e1d2bba1fa1_63bc6c92edf572adc86fd399_Screenshot%2520(145).png","You.com","AI-powered search engine providing personalized results, private search, and AI-driven tools","Research","99","Productivity"
"https://global-uploads.webflow.com/63994dae1033718bee6949ce/63bc4b68f4f137134c3fc1de_63124f96b69fb43d83c4f884_sense-og-spaces.png","Sense","Self-organizing project management tool","Productivity","24",""
"https://global-uploads.webflow.com/63994dae1033718bee6949ce/63bc4b6784fabd55b99836d5___2023-01-05__211315.png","Project Description Generator","AI Project Description Generator","Inspiration","42",""
"https://global-uploads.webflow.com/63994dae1033718bee6949ce/63be4b9aac4c2a5838f157f0_63bb5f5d3d3d7aedff6a7c67_1.jpeg","LanguagePro","Use AI to help you learn a new language","Translation","45","Self-Improvement"
"https://global-uploads.webflow.com/63994dae1033718bee6949ce/63bb5e4da5cc0a82ad766c58_promptextend2.png","PromptExtend","AI Art Prompt Generator","Prompt Guides","33",""
"https://global-uploads.webflow.com/63994dae1033718bee6949ce/63b9e28f14542ac5232bf8fb_cover.png","Endel","Personalized soundscape for focus, relaxation, and sleep","Music","22","Self-Improvement"
"https://global-uploads.webflow.com/63994dae1033718bee6949ce/63be4b9fc9d13e3c65ba1ef1_63bb624ce7d3d485a70a4191_Devices_wiht_ipad_bce87d9f5f.webp","Moises App","Remove vocals and instruments from songs","Music","30",""
"https://global-uploads.webflow.com/63994dae1033718bee6949ce/63be4ba1d526b73d35c8eefb_63bb63c69d70bba354e6bd4b_627ae744d86f6fcd9190d58a_Synth%2520-%2520A_final%25402x.jpeg","Papercup","Translate your video content to any language with synthetic voiceovers","Translation","11",""
"https://global-uploads.webflow.com/63994dae1033718bee6949ce/63b9e28d2551256faf4d4544_61b9f4a385fa68f24cf0326e_Untitled-1-01.png","Altered","Alter your voice with AI for voiceover work","Voice Modulation","23",""
"https://global-uploads.webflow.com/63994dae1033718bee6949ce/63b9e28c6fa9a28e55cc6687_qtpb8td9wpmynlrs.svg","Audo AI","AI Powered Background Noise Removal","Podcasting","48","Voice Modulation"
